No.     Time           Source                Destination           Protocol Length Info
      1 0.000000       192.168.100.102       192.168.100.1         TCP      54     64383 → 8888 [ACK] Seq=1 Ack=1 Win=21372 Len=0

Frame 1: 54 bytes on wire (432 bits), 54 bytes captured (432 bits) on interface \Device\NPF_{762A3821-E4C2-4F33-9E66-D46B35E7C715}, id 0
Ethernet II, Src: DLinkInterna_ca:55:b2 (a0:a3:f0:ca:55:b2), Dst: 9a:03:cf:50:1f:ac (9a:03:cf:50:1f:ac)
    Destination: 9a:03:cf:50:1f:ac (9a:03:cf:50:1f:ac)
        .... ..1. .... .... .... .... = LG bit: Locally administered address (this is NOT the factory default)
        .... ...0 .... .... .... .... = IG bit: Individual address (unicast)
    Source: DLinkInterna_ca:55:b2 (a0:a3:f0:ca:55:b2)
        .... ..0. .... .... .... .... = LG bit: Globally unique address (factory default)
        .... ...0 .... .... .... .... = IG bit: Individual address (unicast)
    Type: IPv4 (0x0800)
    [Stream index: 0]
Internet Protocol Version 4, Src: 192.168.100.102, Dst: 192.168.100.1
    0100 .... = Version: 4
    .... 0101 = Header Length: 20 bytes (5)
    Differentiated Services Field: 0x00 (DSCP: CS0, ECN: Not-ECT)
    Total Length: 40
    Identification: 0x4264 (16996)
    010. .... = Flags: 0x2, Don't fragment
    ...0 0000 0000 0000 = Fragment Offset: 0
    Time to Live: 128
    Protocol: TCP (6)
    Header Checksum: 0x6eb3 [validation disabled]
    [Header checksum status: Unverified]
    Source Address: 192.168.100.102
    Destination Address: 192.168.100.1
    [Stream index: 0]
Transmission Control Protocol, Src Port: 64383, Dst Port: 8888, Seq: 1, Ack: 1, Len: 0
    Source Port: 64383
    Destination Port: 8888
    [Stream index: 0]
    [Stream Packet Number: 1]
    [Conversation completeness: Incomplete (12)]
    [TCP Segment Len: 0]
    Sequence Number: 1    (relative sequence number)
    Sequence Number (raw): 104599421
    [Next Sequence Number: 1    (relative sequence number)]
    Acknowledgment Number: 1    (relative ack number)
    Acknowledgment number (raw): 4020009860
    0101 .... = Header Length: 20 bytes (5)
    Flags: 0x010 (ACK)
    Window: 21372
    [Calculated window size: 21372]
    [Window size scaling factor: -1 (unknown)]
    Checksum: 0x738d [unverified]
    [Checksum Status: Unverified]
    Urgent Pointer: 0
    [Timestamps]

No.     Time           Source                Destination           Protocol Length Info
      2 0.002816       192.168.100.1         192.168.100.102       TCP      174    8888 → 64383 [PSH, ACK] Seq=1 Ack=1 Win=1825 Len=120

Frame 2: 174 bytes on wire (1392 bits), 174 bytes captured (1392 bits) on interface \Device\NPF_{762A3821-E4C2-4F33-9E66-D46B35E7C715}, id 0
Ethernet II, Src: 9a:03:cf:50:1f:ac (9a:03:cf:50:1f:ac), Dst: DLinkInterna_ca:55:b2 (a0:a3:f0:ca:55:b2)
    Destination: DLinkInterna_ca:55:b2 (a0:a3:f0:ca:55:b2)
        .... ..0. .... .... .... .... = LG bit: Globally unique address (factory default)
        .... ...0 .... .... .... .... = IG bit: Individual address (unicast)
    Source: 9a:03:cf:50:1f:ac (9a:03:cf:50:1f:ac)
        .... ..1. .... .... .... .... = LG bit: Locally administered address (this is NOT the factory default)
        .... ...0 .... .... .... .... = IG bit: Individual address (unicast)
    Type: IPv4 (0x0800)
    [Stream index: 0]
Internet Protocol Version 4, Src: 192.168.100.1, Dst: 192.168.100.102
    0100 .... = Version: 4
    .... 0101 = Header Length: 20 bytes (5)
    Differentiated Services Field: 0x00 (DSCP: CS0, ECN: Not-ECT)
    Total Length: 160
    Identification: 0x8e4e (36430)
    010. .... = Flags: 0x2, Don't fragment
    ...0 0000 0000 0000 = Fragment Offset: 0
    Time to Live: 64
    Protocol: TCP (6)
    Header Checksum: 0x6251 [validation disabled]
    [Header checksum status: Unverified]
    Source Address: 192.168.100.1
    Destination Address: 192.168.100.102
    [Stream index: 0]
Transmission Control Protocol, Src Port: 8888, Dst Port: 64383, Seq: 1, Ack: 1, Len: 120
    Source Port: 8888
    Destination Port: 64383
    [Stream index: 0]
    [Stream Packet Number: 2]
    [Conversation completeness: Incomplete (12)]
    [TCP Segment Len: 120]
    Sequence Number: 1    (relative sequence number)
    Sequence Number (raw): 4020009860
    [Next Sequence Number: 121    (relative sequence number)]
    Acknowledgment Number: 1    (relative ack number)
    Acknowledgment number (raw): 104599421
    0101 .... = Header Length: 20 bytes (5)
    Flags: 0x018 (PSH, ACK)
    Window: 1825
    [Calculated window size: 1825]
    [Window size scaling factor: -1 (unknown)]
    Checksum: 0x05f2 [unverified]
    [Checksum Status: Unverified]
    Urgent Pointer: 0
    [Timestamps]
    [SEQ/ACK analysis]
    TCP payload (120 bytes)
Data (120 bytes)

0000  fe 20 24 01 02 ce 3c f4 80 42 2b 02 f9 ff a9 d6   . $...<..B+.....
0010  00 00 00 00 00 00 00 00 00 00 00 00 00 00 00 00   ................
0020  00 00 02 00 00 29 d0 ea fe 20 25 01 02 ce 3c f4   .....)... %...<.
0030  80 42 2c 02 f9 ff a9 d6 00 00 00 00 00 00 00 00   .B,.............
0040  00 00 00 00 00 00 00 00 00 00 02 00 00 29 3a af   .............):.
0050  fe 20 26 01 02 ce 3c f4 80 42 2c 02 f9 ff a9 d6   . &...<..B,.....
0060  00 00 00 00 00 00 00 00 00 00 00 00 00 00 00 00   ................
0070  00 00 03 00 00 29 8e 62                           .....).b
    Data […]: fe20240102ce3cf480422b02f9ffa9d600000000000000000000000000000000000002000029d0eafe20250102ce3cf480422c02f9ffa9d6000000000000000000000000000000000000020000293aaffe20260102ce3cf480422c02f9ffa9d600000000000000000000000000000000000
    [Length: 120]

No.     Time           Source                Destination           Protocol Length Info
      3 0.045795       192.168.100.102       192.168.100.1         TCP      54     64383 → 8888 [ACK] Seq=1 Ack=121 Win=21252 Len=0

Frame 3: 54 bytes on wire (432 bits), 54 bytes captured (432 bits) on interface \Device\NPF_{762A3821-E4C2-4F33-9E66-D46B35E7C715}, id 0
Ethernet II, Src: DLinkInterna_ca:55:b2 (a0:a3:f0:ca:55:b2), Dst: 9a:03:cf:50:1f:ac (9a:03:cf:50:1f:ac)
    Destination: 9a:03:cf:50:1f:ac (9a:03:cf:50:1f:ac)
        .... ..1. .... .... .... .... = LG bit: Locally administered address (this is NOT the factory default)
        .... ...0 .... .... .... .... = IG bit: Individual address (unicast)
    Source: DLinkInterna_ca:55:b2 (a0:a3:f0:ca:55:b2)
        .... ..0. .... .... .... .... = LG bit: Globally unique address (factory default)
        .... ...0 .... .... .... .... = IG bit: Individual address (unicast)
    Type: IPv4 (0x0800)
    [Stream index: 0]
Internet Protocol Version 4, Src: 192.168.100.102, Dst: 192.168.100.1
    0100 .... = Version: 4
    .... 0101 = Header Length: 20 bytes (5)
    Differentiated Services Field: 0x00 (DSCP: CS0, ECN: Not-ECT)
    Total Length: 40
    Identification: 0x4265 (16997)
    010. .... = Flags: 0x2, Don't fragment
    ...0 0000 0000 0000 = Fragment Offset: 0
    Time to Live: 128
    Protocol: TCP (6)
    Header Checksum: 0x6eb2 [validation disabled]
    [Header checksum status: Unverified]
    Source Address: 192.168.100.102
    Destination Address: 192.168.100.1
    [Stream index: 0]
Transmission Control Protocol, Src Port: 64383, Dst Port: 8888, Seq: 1, Ack: 121, Len: 0
    Source Port: 64383
    Destination Port: 8888
    [Stream index: 0]
    [Stream Packet Number: 3]
    [Conversation completeness: Incomplete (12)]
    [TCP Segment Len: 0]
    Sequence Number: 1    (relative sequence number)
    Sequence Number (raw): 104599421
    [Next Sequence Number: 1    (relative sequence number)]
    Acknowledgment Number: 121    (relative ack number)
    Acknowledgment number (raw): 4020009980
    0101 .... = Header Length: 20 bytes (5)
    Flags: 0x010 (ACK)
    Window: 21252
    [Calculated window size: 21252]
    [Window size scaling factor: -1 (unknown)]
    Checksum: 0x738d [unverified]
    [Checksum Status: Unverified]
    Urgent Pointer: 0
    [Timestamps]
    [SEQ/ACK analysis]

No.     Time           Source                Destination           Protocol Length Info
      4 0.048663       192.168.100.1         192.168.100.102       TCP      134    8888 → 64383 [PSH, ACK] Seq=121 Ack=1 Win=1825 Len=80

Frame 4: 134 bytes on wire (1072 bits), 134 bytes captured (1072 bits) on interface \Device\NPF_{762A3821-E4C2-4F33-9E66-D46B35E7C715}, id 0
Ethernet II, Src: 9a:03:cf:50:1f:ac (9a:03:cf:50:1f:ac), Dst: DLinkInterna_ca:55:b2 (a0:a3:f0:ca:55:b2)
    Destination: DLinkInterna_ca:55:b2 (a0:a3:f0:ca:55:b2)
        .... ..0. .... .... .... .... = LG bit: Globally unique address (factory default)
        .... ...0 .... .... .... .... = IG bit: Individual address (unicast)
    Source: 9a:03:cf:50:1f:ac (9a:03:cf:50:1f:ac)
        .... ..1. .... .... .... .... = LG bit: Locally administered address (this is NOT the factory default)
        .... ...0 .... .... .... .... = IG bit: Individual address (unicast)
    Type: IPv4 (0x0800)
    [Stream index: 0]
Internet Protocol Version 4, Src: 192.168.100.1, Dst: 192.168.100.102
    0100 .... = Version: 4
    .... 0101 = Header Length: 20 bytes (5)
    Differentiated Services Field: 0x00 (DSCP: CS0, ECN: Not-ECT)
    Total Length: 120
    Identification: 0x8e4f (36431)
    010. .... = Flags: 0x2, Don't fragment
    ...0 0000 0000 0000 = Fragment Offset: 0
    Time to Live: 64
    Protocol: TCP (6)
    Header Checksum: 0x6278 [validation disabled]
    [Header checksum status: Unverified]
    Source Address: 192.168.100.1
    Destination Address: 192.168.100.102
    [Stream index: 0]
Transmission Control Protocol, Src Port: 8888, Dst Port: 64383, Seq: 121, Ack: 1, Len: 80
    Source Port: 8888
    Destination Port: 64383
    [Stream index: 0]
    [Stream Packet Number: 4]
    [Conversation completeness: Incomplete (12)]
    [TCP Segment Len: 80]
    Sequence Number: 121    (relative sequence number)
    Sequence Number (raw): 4020009980
    [Next Sequence Number: 201    (relative sequence number)]
    Acknowledgment Number: 1    (relative ack number)
    Acknowledgment number (raw): 104599421
    0101 .... = Header Length: 20 bytes (5)
    Flags: 0x018 (PSH, ACK)
    Window: 1825
    [Calculated window size: 1825]
    [Window size scaling factor: -1 (unknown)]
    Checksum: 0xe87b [unverified]
    [Checksum Status: Unverified]
    Urgent Pointer: 0
    [Timestamps]
    [SEQ/ACK analysis]
    TCP payload (80 bytes)
Data (80 bytes)

0000  fe 20 27 01 02 ce b4 fd 80 42 2c 02 f9 ff a9 d6   . '......B,.....
0010  00 00 00 00 00 00 00 00 00 00 00 00 00 00 00 00   ................
0020  00 00 03 00 00 29 1b 24 fe 20 28 01 02 ce 3c f4   .....).$. (...<.
0030  80 42 2c 02 f9 ff a9 d6 00 00 00 00 00 00 00 00   .B,.............
0040  00 00 00 00 00 00 00 00 00 00 03 00 00 29 d2 1d   .............)..
    Data: fe20270102ceb4fd80422c02f9ffa9d6000000000000000000000000000000000000030000291b24fe20280102ce3cf480422c02f9ffa9d600000000000000000000000000000000000003000029d21d
    [Length: 80]

No.     Time           Source                Destination           Protocol Length Info
      5 0.092667       192.168.100.102       192.168.100.1         TCP      54     64383 → 8888 [ACK] Seq=1 Ack=201 Win=21172 Len=0

Frame 5: 54 bytes on wire (432 bits), 54 bytes captured (432 bits) on interface \Device\NPF_{762A3821-E4C2-4F33-9E66-D46B35E7C715}, id 0
Ethernet II, Src: DLinkInterna_ca:55:b2 (a0:a3:f0:ca:55:b2), Dst: 9a:03:cf:50:1f:ac (9a:03:cf:50:1f:ac)
    Destination: 9a:03:cf:50:1f:ac (9a:03:cf:50:1f:ac)
        .... ..1. .... .... .... .... = LG bit: Locally administered address (this is NOT the factory default)
        .... ...0 .... .... .... .... = IG bit: Individual address (unicast)
    Source: DLinkInterna_ca:55:b2 (a0:a3:f0:ca:55:b2)
        .... ..0. .... .... .... .... = LG bit: Globally unique address (factory default)
        .... ...0 .... .... .... .... = IG bit: Individual address (unicast)
    Type: IPv4 (0x0800)
    [Stream index: 0]
Internet Protocol Version 4, Src: 192.168.100.102, Dst: 192.168.100.1
    0100 .... = Version: 4
    .... 0101 = Header Length: 20 bytes (5)
    Differentiated Services Field: 0x00 (DSCP: CS0, ECN: Not-ECT)
    Total Length: 40
    Identification: 0x4266 (16998)
    010. .... = Flags: 0x2, Don't fragment
    ...0 0000 0000 0000 = Fragment Offset: 0
    Time to Live: 128
    Protocol: TCP (6)
    Header Checksum: 0x6eb1 [validation disabled]
    [Header checksum status: Unverified]
    Source Address: 192.168.100.102
    Destination Address: 192.168.100.1
    [Stream index: 0]
Transmission Control Protocol, Src Port: 64383, Dst Port: 8888, Seq: 1, Ack: 201, Len: 0
    Source Port: 64383
    Destination Port: 8888
    [Stream index: 0]
    [Stream Packet Number: 5]
    [Conversation completeness: Incomplete (12)]
    [TCP Segment Len: 0]
    Sequence Number: 1    (relative sequence number)
    Sequence Number (raw): 104599421
    [Next Sequence Number: 1    (relative sequence number)]
    Acknowledgment Number: 201    (relative ack number)
    Acknowledgment number (raw): 4020010060
    0101 .... = Header Length: 20 bytes (5)
    Flags: 0x010 (ACK)
    Window: 21172
    [Calculated window size: 21172]
    [Window size scaling factor: -1 (unknown)]
    Checksum: 0x738d [unverified]
    [Checksum Status: Unverified]
    Urgent Pointer: 0
    [Timestamps]
    [SEQ/ACK analysis]

No.     Time           Source                Destination           Protocol Length Info
      6 0.095707       192.168.100.1         192.168.100.102       TCP      134    8888 → 64383 [PSH, ACK] Seq=201 Ack=1 Win=1825 Len=80

Frame 6: 134 bytes on wire (1072 bits), 134 bytes captured (1072 bits) on interface \Device\NPF_{762A3821-E4C2-4F33-9E66-D46B35E7C715}, id 0
Ethernet II, Src: 9a:03:cf:50:1f:ac (9a:03:cf:50:1f:ac), Dst: DLinkInterna_ca:55:b2 (a0:a3:f0:ca:55:b2)
    Destination: DLinkInterna_ca:55:b2 (a0:a3:f0:ca:55:b2)
        .... ..0. .... .... .... .... = LG bit: Globally unique address (factory default)
        .... ...0 .... .... .... .... = IG bit: Individual address (unicast)
    Source: 9a:03:cf:50:1f:ac (9a:03:cf:50:1f:ac)
        .... ..1. .... .... .... .... = LG bit: Locally administered address (this is NOT the factory default)
        .... ...0 .... .... .... .... = IG bit: Individual address (unicast)
    Type: IPv4 (0x0800)
    [Stream index: 0]
Internet Protocol Version 4, Src: 192.168.100.1, Dst: 192.168.100.102
    0100 .... = Version: 4
    .... 0101 = Header Length: 20 bytes (5)
    Differentiated Services Field: 0x00 (DSCP: CS0, ECN: Not-ECT)
    Total Length: 120
    Identification: 0x8e50 (36432)
    010. .... = Flags: 0x2, Don't fragment
    ...0 0000 0000 0000 = Fragment Offset: 0
    Time to Live: 64
    Protocol: TCP (6)
    Header Checksum: 0x6277 [validation disabled]
    [Header checksum status: Unverified]
    Source Address: 192.168.100.1
    Destination Address: 192.168.100.102
    [Stream index: 0]
Transmission Control Protocol, Src Port: 8888, Dst Port: 64383, Seq: 201, Ack: 1, Len: 80
    Source Port: 8888
    Destination Port: 64383
    [Stream index: 0]
    [Stream Packet Number: 6]
    [Conversation completeness: Incomplete (12)]
    [TCP Segment Len: 80]
    Sequence Number: 201    (relative sequence number)
    Sequence Number (raw): 4020010060
    [Next Sequence Number: 281    (relative sequence number)]
    Acknowledgment Number: 1    (relative ack number)
    Acknowledgment number (raw): 104599421
    0101 .... = Header Length: 20 bytes (5)
    Flags: 0x018 (PSH, ACK)
    Window: 1825
    [Calculated window size: 1825]
    [Window size scaling factor: -1 (unknown)]
    Checksum: 0x74b0 [unverified]
    [Checksum Status: Unverified]
    Urgent Pointer: 0
    [Timestamps]
    [SEQ/ACK analysis]
    TCP payload (80 bytes)
Data (80 bytes)

0000  fe 20 29 01 02 ce 3c f4 80 42 2c 02 f9 ff a9 d6   . )...<..B,.....
0010  00 00 00 00 00 00 00 00 00 00 00 00 00 00 00 00   ................
0020  00 00 02 00 00 29 c9 ac fe 20 2a 01 02 ce 69 00   .....)... *...i.
0030  81 42 2c 02 f9 ff a9 d6 00 00 00 00 00 00 00 00   .B,.............
0040  00 00 00 00 00 00 00 00 00 00 02 00 00 29 e0 0d   .............)..
    Data: fe20290102ce3cf480422c02f9ffa9d600000000000000000000000000000000000002000029c9acfe202a0102ce690081422c02f9ffa9d600000000000000000000000000000000000002000029e00d
    [Length: 80]

No.     Time           Source                Destination           Protocol Length Info
      7 0.140145       192.168.100.102       192.168.100.1         TCP      54     64383 → 8888 [ACK] Seq=1 Ack=281 Win=21092 Len=0

Frame 7: 54 bytes on wire (432 bits), 54 bytes captured (432 bits) on interface \Device\NPF_{762A3821-E4C2-4F33-9E66-D46B35E7C715}, id 0
Ethernet II, Src: DLinkInterna_ca:55:b2 (a0:a3:f0:ca:55:b2), Dst: 9a:03:cf:50:1f:ac (9a:03:cf:50:1f:ac)
    Destination: 9a:03:cf:50:1f:ac (9a:03:cf:50:1f:ac)
        .... ..1. .... .... .... .... = LG bit: Locally administered address (this is NOT the factory default)
        .... ...0 .... .... .... .... = IG bit: Individual address (unicast)
    Source: DLinkInterna_ca:55:b2 (a0:a3:f0:ca:55:b2)
        .... ..0. .... .... .... .... = LG bit: Globally unique address (factory default)
        .... ...0 .... .... .... .... = IG bit: Individual address (unicast)
    Type: IPv4 (0x0800)
    [Stream index: 0]
Internet Protocol Version 4, Src: 192.168.100.102, Dst: 192.168.100.1
    0100 .... = Version: 4
    .... 0101 = Header Length: 20 bytes (5)
    Differentiated Services Field: 0x00 (DSCP: CS0, ECN: Not-ECT)
    Total Length: 40
    Identification: 0x4267 (16999)
    010. .... = Flags: 0x2, Don't fragment
    ...0 0000 0000 0000 = Fragment Offset: 0
    Time to Live: 128
    Protocol: TCP (6)
    Header Checksum: 0x6eb0 [validation disabled]
    [Header checksum status: Unverified]
    Source Address: 192.168.100.102
    Destination Address: 192.168.100.1
    [Stream index: 0]
Transmission Control Protocol, Src Port: 64383, Dst Port: 8888, Seq: 1, Ack: 281, Len: 0
    Source Port: 64383
    Destination Port: 8888
    [Stream index: 0]
    [Stream Packet Number: 7]
    [Conversation completeness: Incomplete (12)]
    [TCP Segment Len: 0]
    Sequence Number: 1    (relative sequence number)
    Sequence Number (raw): 104599421
    [Next Sequence Number: 1    (relative sequence number)]
    Acknowledgment Number: 281    (relative ack number)
    Acknowledgment number (raw): 4020010140
    0101 .... = Header Length: 20 bytes (5)
    Flags: 0x010 (ACK)
    Window: 21092
    [Calculated window size: 21092]
    [Window size scaling factor: -1 (unknown)]
    Checksum: 0x738d [unverified]
    [Checksum Status: Unverified]
    Urgent Pointer: 0
    [Timestamps]
    [SEQ/ACK analysis]

No.     Time           Source                Destination           Protocol Length Info
      8 0.148192       192.168.100.1         192.168.100.102       TCP      174    8888 → 64383 [PSH, ACK] Seq=281 Ack=1 Win=1825 Len=120

Frame 8: 174 bytes on wire (1392 bits), 174 bytes captured (1392 bits) on interface \Device\NPF_{762A3821-E4C2-4F33-9E66-D46B35E7C715}, id 0
Ethernet II, Src: 9a:03:cf:50:1f:ac (9a:03:cf:50:1f:ac), Dst: DLinkInterna_ca:55:b2 (a0:a3:f0:ca:55:b2)
    Destination: DLinkInterna_ca:55:b2 (a0:a3:f0:ca:55:b2)
        .... ..0. .... .... .... .... = LG bit: Globally unique address (factory default)
        .... ...0 .... .... .... .... = IG bit: Individual address (unicast)
    Source: 9a:03:cf:50:1f:ac (9a:03:cf:50:1f:ac)
        .... ..1. .... .... .... .... = LG bit: Locally administered address (this is NOT the factory default)
        .... ...0 .... .... .... .... = IG bit: Individual address (unicast)
    Type: IPv4 (0x0800)
    [Stream index: 0]
Internet Protocol Version 4, Src: 192.168.100.1, Dst: 192.168.100.102
    0100 .... = Version: 4
    .... 0101 = Header Length: 20 bytes (5)
    Differentiated Services Field: 0x00 (DSCP: CS0, ECN: Not-ECT)
    Total Length: 160
    Identification: 0x8e51 (36433)
    010. .... = Flags: 0x2, Don't fragment
    ...0 0000 0000 0000 = Fragment Offset: 0
    Time to Live: 64
    Protocol: TCP (6)
    Header Checksum: 0x624e [validation disabled]
    [Header checksum status: Unverified]
    Source Address: 192.168.100.1
    Destination Address: 192.168.100.102
    [Stream index: 0]
Transmission Control Protocol, Src Port: 8888, Dst Port: 64383, Seq: 281, Ack: 1, Len: 120
    Source Port: 8888
    Destination Port: 64383
    [Stream index: 0]
    [Stream Packet Number: 8]
    [Conversation completeness: Incomplete (12)]
    [TCP Segment Len: 120]
    Sequence Number: 281    (relative sequence number)
    Sequence Number (raw): 4020010140
    [Next Sequence Number: 401    (relative sequence number)]
    Acknowledgment Number: 1    (relative ack number)
    Acknowledgment number (raw): 104599421
    0101 .... = Header Length: 20 bytes (5)
    Flags: 0x018 (PSH, ACK)
    Window: 1825
    [Calculated window size: 1825]
    [Window size scaling factor: -1 (unknown)]
    Checksum: 0x4d5e [unverified]
    [Checksum Status: Unverified]
    Urgent Pointer: 0
    [Timestamps]
    [SEQ/ACK analysis]
    TCP payload (120 bytes)
Data (120 bytes)

0000  fe 20 2b 01 02 ce 69 00 81 42 2c 02 f9 ff a8 d6   . +...i..B,.....
0010  00 00 00 00 00 00 00 00 00 00 00 00 00 00 00 00   ................
0020  00 00 03 00 00 29 80 b8 fe 20 2c 01 02 ce d2 ee   .....)... ,.....
0030  80 42 2c 02 f9 ff a8 d6 00 00 00 00 00 00 00 00   .B,.............
0040  00 00 00 00 00 00 00 00 00 00 03 00 00 29 af 97   .............)..
0050  fe 20 2d 01 02 ce d2 ee 80 42 2c 02 f9 ff a8 d6   . -......B,.....
0060  00 00 00 00 00 00 00 00 00 00 00 00 00 00 00 00   ................
0070  00 00 02 00 00 29 b4 26                           .....).&
    Data […]: fe202b0102ce690081422c02f9ffa8d60000000000000000000000000000000000000300002980b8fe202c0102ced2ee80422c02f9ffa8d600000000000000000000000000000000000003000029af97fe202d0102ced2ee80422c02f9ffa8d600000000000000000000000000000000000
    [Length: 120]

No.     Time           Source                Destination           Protocol Length Info
      9 0.201249       192.168.100.102       192.168.100.1         TCP      54     64383 → 8888 [ACK] Seq=1 Ack=401 Win=20972 Len=0

Frame 9: 54 bytes on wire (432 bits), 54 bytes captured (432 bits) on interface \Device\NPF_{762A3821-E4C2-4F33-9E66-D46B35E7C715}, id 0
Ethernet II, Src: DLinkInterna_ca:55:b2 (a0:a3:f0:ca:55:b2), Dst: 9a:03:cf:50:1f:ac (9a:03:cf:50:1f:ac)
    Destination: 9a:03:cf:50:1f:ac (9a:03:cf:50:1f:ac)
        .... ..1. .... .... .... .... = LG bit: Locally administered address (this is NOT the factory default)
        .... ...0 .... .... .... .... = IG bit: Individual address (unicast)
    Source: DLinkInterna_ca:55:b2 (a0:a3:f0:ca:55:b2)
        .... ..0. .... .... .... .... = LG bit: Globally unique address (factory default)
        .... ...0 .... .... .... .... = IG bit: Individual address (unicast)
    Type: IPv4 (0x0800)
    [Stream index: 0]
Internet Protocol Version 4, Src: 192.168.100.102, Dst: 192.168.100.1
    0100 .... = Version: 4
    .... 0101 = Header Length: 20 bytes (5)
    Differentiated Services Field: 0x00 (DSCP: CS0, ECN: Not-ECT)
    Total Length: 40
    Identification: 0x4268 (17000)
    010. .... = Flags: 0x2, Don't fragment
    ...0 0000 0000 0000 = Fragment Offset: 0
    Time to Live: 128
    Protocol: TCP (6)
    Header Checksum: 0x6eaf [validation disabled]
    [Header checksum status: Unverified]
    Source Address: 192.168.100.102
    Destination Address: 192.168.100.1
    [Stream index: 0]
Transmission Control Protocol, Src Port: 64383, Dst Port: 8888, Seq: 1, Ack: 401, Len: 0
    Source Port: 64383
    Destination Port: 8888
    [Stream index: 0]
    [Stream Packet Number: 9]
    [Conversation completeness: Incomplete (12)]
    [TCP Segment Len: 0]
    Sequence Number: 1    (relative sequence number)
    Sequence Number (raw): 104599421
    [Next Sequence Number: 1    (relative sequence number)]
    Acknowledgment Number: 401    (relative ack number)
    Acknowledgment number (raw): 4020010260
    0101 .... = Header Length: 20 bytes (5)
    Flags: 0x010 (ACK)
    Window: 20972
    [Calculated window size: 20972]
    [Window size scaling factor: -1 (unknown)]
    Checksum: 0x738d [unverified]
    [Checksum Status: Unverified]
    Urgent Pointer: 0
    [Timestamps]
    [SEQ/ACK analysis]

No.     Time           Source                Destination           Protocol Length Info
     10 0.205146       192.168.100.1         192.168.100.102       TCP      134    8888 → 64383 [PSH, ACK] Seq=401 Ack=1 Win=1825 Len=80

Frame 10: 134 bytes on wire (1072 bits), 134 bytes captured (1072 bits) on interface \Device\NPF_{762A3821-E4C2-4F33-9E66-D46B35E7C715}, id 0
Ethernet II, Src: 9a:03:cf:50:1f:ac (9a:03:cf:50:1f:ac), Dst: DLinkInterna_ca:55:b2 (a0:a3:f0:ca:55:b2)
    Destination: DLinkInterna_ca:55:b2 (a0:a3:f0:ca:55:b2)
        .... ..0. .... .... .... .... = LG bit: Globally unique address (factory default)
        .... ...0 .... .... .... .... = IG bit: Individual address (unicast)
    Source: 9a:03:cf:50:1f:ac (9a:03:cf:50:1f:ac)
        .... ..1. .... .... .... .... = LG bit: Locally administered address (this is NOT the factory default)
        .... ...0 .... .... .... .... = IG bit: Individual address (unicast)
    Type: IPv4 (0x0800)
    [Stream index: 0]
Internet Protocol Version 4, Src: 192.168.100.1, Dst: 192.168.100.102
    0100 .... = Version: 4
    .... 0101 = Header Length: 20 bytes (5)
    Differentiated Services Field: 0x00 (DSCP: CS0, ECN: Not-ECT)
    Total Length: 120
    Identification: 0x8e52 (36434)
    010. .... = Flags: 0x2, Don't fragment
    ...0 0000 0000 0000 = Fragment Offset: 0
    Time to Live: 64
    Protocol: TCP (6)
    Header Checksum: 0x6275 [validation disabled]
    [Header checksum status: Unverified]
    Source Address: 192.168.100.1
    Destination Address: 192.168.100.102
    [Stream index: 0]
Transmission Control Protocol, Src Port: 8888, Dst Port: 64383, Seq: 401, Ack: 1, Len: 80
    Source Port: 8888
    Destination Port: 64383
    [Stream index: 0]
    [Stream Packet Number: 10]
    [Conversation completeness: Incomplete (12)]
    [TCP Segment Len: 80]
    Sequence Number: 401    (relative sequence number)
    Sequence Number (raw): 4020010260
    [Next Sequence Number: 481    (relative sequence number)]
    Acknowledgment Number: 1    (relative ack number)
    Acknowledgment number (raw): 104599421
    0101 .... = Header Length: 20 bytes (5)
    Flags: 0x018 (PSH, ACK)
    Window: 1825
    [Calculated window size: 1825]
    [Window size scaling factor: -1 (unknown)]
    Checksum: 0xcb6e [unverified]
    [Checksum Status: Unverified]
    Urgent Pointer: 0
    [Timestamps]
    [SEQ/ACK analysis]
    TCP payload (80 bytes)
Data (80 bytes)

0000  fe 20 2e 01 02 ce d2 ee 80 42 2c 02 f9 ff a8 d6   . .......B,.....
0010  00 00 00 00 00 00 00 00 00 00 00 00 00 00 00 00   ................
0020  00 00 02 00 00 29 44 e0 fe 20 2f 01 02 ce 4b f8   .....)D.. /...K.
0030  80 42 2c 02 f9 ff a8 d6 00 00 00 00 00 00 00 00   .B,.............
0040  00 00 00 00 00 00 00 00 00 00 02 00 00 29 8d 61   .............).a
    Data: fe202e0102ced2ee80422c02f9ffa8d60000000000000000000000000000000000000200002944e0fe202f0102ce4bf880422c02f9ffa8d6000000000000000000000000000000000000020000298d61
    [Length: 80]

No.     Time           Source                Destination           Protocol Length Info
     11 0.247053       192.168.100.102       192.168.100.1         TCP      54     64383 → 8888 [ACK] Seq=1 Ack=481 Win=20892 Len=0

Frame 11: 54 bytes on wire (432 bits), 54 bytes captured (432 bits) on interface \Device\NPF_{762A3821-E4C2-4F33-9E66-D46B35E7C715}, id 0
Ethernet II, Src: DLinkInterna_ca:55:b2 (a0:a3:f0:ca:55:b2), Dst: 9a:03:cf:50:1f:ac (9a:03:cf:50:1f:ac)
    Destination: 9a:03:cf:50:1f:ac (9a:03:cf:50:1f:ac)
        .... ..1. .... .... .... .... = LG bit: Locally administered address (this is NOT the factory default)
        .... ...0 .... .... .... .... = IG bit: Individual address (unicast)
    Source: DLinkInterna_ca:55:b2 (a0:a3:f0:ca:55:b2)
        .... ..0. .... .... .... .... = LG bit: Globally unique address (factory default)
        .... ...0 .... .... .... .... = IG bit: Individual address (unicast)
    Type: IPv4 (0x0800)
    [Stream index: 0]
Internet Protocol Version 4, Src: 192.168.100.102, Dst: 192.168.100.1
    0100 .... = Version: 4
    .... 0101 = Header Length: 20 bytes (5)
    Differentiated Services Field: 0x00 (DSCP: CS0, ECN: Not-ECT)
    Total Length: 40
    Identification: 0x4269 (17001)
    010. .... = Flags: 0x2, Don't fragment
    ...0 0000 0000 0000 = Fragment Offset: 0
    Time to Live: 128
    Protocol: TCP (6)
    Header Checksum: 0x6eae [validation disabled]
    [Header checksum status: Unverified]
    Source Address: 192.168.100.102
    Destination Address: 192.168.100.1
    [Stream index: 0]
Transmission Control Protocol, Src Port: 64383, Dst Port: 8888, Seq: 1, Ack: 481, Len: 0
    Source Port: 64383
    Destination Port: 8888
    [Stream index: 0]
    [Stream Packet Number: 11]
    [Conversation completeness: Incomplete (12)]
    [TCP Segment Len: 0]
    Sequence Number: 1    (relative sequence number)
    Sequence Number (raw): 104599421
    [Next Sequence Number: 1    (relative sequence number)]
    Acknowledgment Number: 481    (relative ack number)
    Acknowledgment number (raw): 4020010340
    0101 .... = Header Length: 20 bytes (5)
    Flags: 0x010 (ACK)
    Window: 20892
    [Calculated window size: 20892]
    [Window size scaling factor: -1 (unknown)]
    Checksum: 0x738d [unverified]
    [Checksum Status: Unverified]
    Urgent Pointer: 0
    [Timestamps]
    [SEQ/ACK analysis]

No.     Time           Source                Destination           Protocol Length Info
     12 0.358600       192.168.100.1         192.168.100.102       ICMP     98     Echo (ping) request  id=0xd849, seq=0/0, ttl=64 (reply in 13)

Frame 12: 98 bytes on wire (784 bits), 98 bytes captured (784 bits) on interface \Device\NPF_{762A3821-E4C2-4F33-9E66-D46B35E7C715}, id 0
Ethernet II, Src: 9a:03:cf:50:1f:ac (9a:03:cf:50:1f:ac), Dst: DLinkInterna_ca:55:b2 (a0:a3:f0:ca:55:b2)
    Destination: DLinkInterna_ca:55:b2 (a0:a3:f0:ca:55:b2)
        .... ..0. .... .... .... .... = LG bit: Globally unique address (factory default)
        .... ...0 .... .... .... .... = IG bit: Individual address (unicast)
    Source: 9a:03:cf:50:1f:ac (9a:03:cf:50:1f:ac)
        .... ..1. .... .... .... .... = LG bit: Locally administered address (this is NOT the factory default)
        .... ...0 .... .... .... .... = IG bit: Individual address (unicast)
    Type: IPv4 (0x0800)
    [Stream index: 0]
Internet Protocol Version 4, Src: 192.168.100.1, Dst: 192.168.100.102
    0100 .... = Version: 4
    .... 0101 = Header Length: 20 bytes (5)
    Differentiated Services Field: 0x00 (DSCP: CS0, ECN: Not-ECT)
    Total Length: 84
    Identification: 0x964d (38477)
    010. .... = Flags: 0x2, Don't fragment
    ...0 0000 0000 0000 = Fragment Offset: 0
    Time to Live: 64
    Protocol: ICMP (1)
    Header Checksum: 0x5aa3 [validation disabled]
    [Header checksum status: Unverified]
    Source Address: 192.168.100.1
    Destination Address: 192.168.100.102
    [Stream index: 0]
Internet Control Message Protocol
    Type: 8 (Echo (ping) request)
    Code: 0
    Checksum: 0x3a5a [correct]
    [Checksum Status: Good]
    Identifier (BE): 55369 (0xd849)
    Identifier (LE): 18904 (0x49d8)
    Sequence Number (BE): 0 (0x0000)
    Sequence Number (LE): 0 (0x0000)
    [Response frame: 13]
    Data (56 bytes)

0000  fb 97 e9 c3 00 00 00 00 00 00 00 00 00 00 00 00   ................
0010  00 00 00 00 00 00 00 00 00 00 00 00 00 00 00 00   ................
0020  00 00 00 00 00 00 00 00 00 00 00 00 00 00 00 00   ................
0030  00 00 00 00 00 00 00 00                           ........
        Data: fb97e9c300000000000000000000000000000000000000000000000000000000000000000000000000000000000000000000000000000000
        [Length: 56]

No.     Time           Source                Destination           Protocol Length Info
     13 0.358926       192.168.100.102       192.168.100.1         ICMP     98     Echo (ping) reply    id=0xd849, seq=0/0, ttl=128 (request in 12)

Frame 13: 98 bytes on wire (784 bits), 98 bytes captured (784 bits) on interface \Device\NPF_{762A3821-E4C2-4F33-9E66-D46B35E7C715}, id 0
Ethernet II, Src: DLinkInterna_ca:55:b2 (a0:a3:f0:ca:55:b2), Dst: 9a:03:cf:50:1f:ac (9a:03:cf:50:1f:ac)
    Destination: 9a:03:cf:50:1f:ac (9a:03:cf:50:1f:ac)
        .... ..1. .... .... .... .... = LG bit: Locally administered address (this is NOT the factory default)
        .... ...0 .... .... .... .... = IG bit: Individual address (unicast)
    Source: DLinkInterna_ca:55:b2 (a0:a3:f0:ca:55:b2)
        .... ..0. .... .... .... .... = LG bit: Globally unique address (factory default)
        .... ...0 .... .... .... .... = IG bit: Individual address (unicast)
    Type: IPv4 (0x0800)
    [Stream index: 0]
Internet Protocol Version 4, Src: 192.168.100.102, Dst: 192.168.100.1
    0100 .... = Version: 4
    .... 0101 = Header Length: 20 bytes (5)
    Differentiated Services Field: 0x00 (DSCP: CS0, ECN: Not-ECT)
    Total Length: 84
    Identification: 0x426a (17002)
    000. .... = Flags: 0x0
    ...0 0000 0000 0000 = Fragment Offset: 0
    Time to Live: 128
    Protocol: ICMP (1)
    Header Checksum: 0xae86 [validation disabled]
    [Header checksum status: Unverified]
    Source Address: 192.168.100.102
    Destination Address: 192.168.100.1
    [Stream index: 0]
Internet Control Message Protocol
    Type: 0 (Echo (ping) reply)
    Code: 0
    Checksum: 0x425a [correct]
    [Checksum Status: Good]
    Identifier (BE): 55369 (0xd849)
    Identifier (LE): 18904 (0x49d8)
    Sequence Number (BE): 0 (0x0000)
    Sequence Number (LE): 0 (0x0000)
    [Request frame: 12]
    [Response time: 0,326 ms]
    Data (56 bytes)

0000  fb 97 e9 c3 00 00 00 00 00 00 00 00 00 00 00 00   ................
0010  00 00 00 00 00 00 00 00 00 00 00 00 00 00 00 00   ................
0020  00 00 00 00 00 00 00 00 00 00 00 00 00 00 00 00   ................
0030  00 00 00 00 00 00 00 00                           ........
        Data: fb97e9c300000000000000000000000000000000000000000000000000000000000000000000000000000000000000000000000000000000
        [Length: 56]

No.     Time           Source                Destination           Protocol Length Info
     14 0.424811       192.168.100.1         192.168.100.255       UDP      86     46573 → 8668 Len=44

Frame 14: 86 bytes on wire (688 bits), 86 bytes captured (688 bits) on interface \Device\NPF_{762A3821-E4C2-4F33-9E66-D46B35E7C715}, id 0
Ethernet II, Src: 9a:03:cf:50:1f:ac (9a:03:cf:50:1f:ac), Dst: Broadcast (ff:ff:ff:ff:ff:ff)
    Destination: Broadcast (ff:ff:ff:ff:ff:ff)
        .... ..1. .... .... .... .... = LG bit: Locally administered address (this is NOT the factory default)
        .... ...1 .... .... .... .... = IG bit: Group address (multicast/broadcast)
    Source: 9a:03:cf:50:1f:ac (9a:03:cf:50:1f:ac)
        .... ..1. .... .... .... .... = LG bit: Locally administered address (this is NOT the factory default)
        .... ...0 .... .... .... .... = IG bit: Individual address (unicast)
    Type: IPv4 (0x0800)
    [Stream index: 1]
Internet Protocol Version 4, Src: 192.168.100.1, Dst: 192.168.100.255
    0100 .... = Version: 4
    .... 0101 = Header Length: 20 bytes (5)
    Differentiated Services Field: 0x00 (DSCP: CS0, ECN: Not-ECT)
    Total Length: 72
    Identification: 0x4201 (16897)
    010. .... = Flags: 0x2, Don't fragment
    ...0 0000 0000 0000 = Fragment Offset: 0
    Time to Live: 64
    Protocol: UDP (17)
    Header Checksum: 0xae52 [validation disabled]
    [Header checksum status: Unverified]
    Source Address: 192.168.100.1
    Destination Address: 192.168.100.255
    [Stream index: 1]
User Datagram Protocol, Src Port: 46573, Dst Port: 8668
Data (44 bytes)

0000  fe 24 8a 00 00 e8 43 4e 32 34 30 32 30 31 30 39   .$....CN24020109
0010  36 30 00 00 00 00 31 39 32 2e 31 36 38 2e 31 30   60....192.168.10
0020  30 2e 31 00 00 00 c0 00 66 00 05 25               0.1.....f..%
    Data: fe248a0000e8434e32343032303130393630000000003139322e3136382e3130302e31000000c00066000525
    [Length: 44]

No.     Time           Source                Destination           Protocol Length Info
     15 0.458191       192.168.100.1         192.168.100.102       TCP      574    8888 → 64383 [PSH, ACK] Seq=481 Ack=1 Win=1825 Len=520

Frame 15: 574 bytes on wire (4592 bits), 574 bytes captured (4592 bits) on interface \Device\NPF_{762A3821-E4C2-4F33-9E66-D46B35E7C715}, id 0
Ethernet II, Src: 9a:03:cf:50:1f:ac (9a:03:cf:50:1f:ac), Dst: DLinkInterna_ca:55:b2 (a0:a3:f0:ca:55:b2)
    Destination: DLinkInterna_ca:55:b2 (a0:a3:f0:ca:55:b2)
        .... ..0. .... .... .... .... = LG bit: Globally unique address (factory default)
        .... ...0 .... .... .... .... = IG bit: Individual address (unicast)
    Source: 9a:03:cf:50:1f:ac (9a:03:cf:50:1f:ac)
        .... ..1. .... .... .... .... = LG bit: Locally administered address (this is NOT the factory default)
        .... ...0 .... .... .... .... = IG bit: Individual address (unicast)
    Type: IPv4 (0x0800)
    [Stream index: 0]
Internet Protocol Version 4, Src: 192.168.100.1, Dst: 192.168.100.102
    0100 .... = Version: 4
    .... 0101 = Header Length: 20 bytes (5)
    Differentiated Services Field: 0x00 (DSCP: CS0, ECN: Not-ECT)
    Total Length: 560
    Identification: 0x8e53 (36435)
    010. .... = Flags: 0x2, Don't fragment
    ...0 0000 0000 0000 = Fragment Offset: 0
    Time to Live: 64
    Protocol: TCP (6)
    Header Checksum: 0x60bc [validation disabled]
    [Header checksum status: Unverified]
    Source Address: 192.168.100.1
    Destination Address: 192.168.100.102
    [Stream index: 0]
Transmission Control Protocol, Src Port: 8888, Dst Port: 64383, Seq: 481, Ack: 1, Len: 520
    Source Port: 8888
    Destination Port: 64383
    [Stream index: 0]
    [Stream Packet Number: 12]
    [Conversation completeness: Incomplete (12)]
    [TCP Segment Len: 520]
    Sequence Number: 481    (relative sequence number)
    Sequence Number (raw): 4020010340
    [Next Sequence Number: 1001    (relative sequence number)]
    Acknowledgment Number: 1    (relative ack number)
    Acknowledgment number (raw): 104599421
    0101 .... = Header Length: 20 bytes (5)
    Flags: 0x018 (PSH, ACK)
    Window: 1825
    [Calculated window size: 1825]
    [Window size scaling factor: -1 (unknown)]
    Checksum: 0x5b7e [unverified]
    [Checksum Status: Unverified]
    Urgent Pointer: 0
    [Timestamps]
    [SEQ/ACK analysis]
    TCP payload (520 bytes)
Data (520 bytes)

0000  fe 20 30 01 02 ce d2 ee 80 42 2c 02 f9 ff a8 d6   . 0......B,.....
0010  00 00 00 00 00 00 00 00 00 00 00 00 00 00 00 00   ................
0020  00 00 03 00 00 29 17 69 fe 20 31 01 02 ce 2d f0   .....).i. 1...-.
0030  80 42 2c 02 f9 ff a8 d6 00 00 00 00 00 00 00 00   .B,.............
0040  00 00 00 00 00 00 00 00 00 00 03 00 00 29 9e 17   .............)..
0050  fe 20 32 01 02 ce 2d f0 80 42 2c 02 f9 ff a8 d6   . 2...-..B,.....
