"No.","Time","Source","Destination","Protocol","Length","Info"
"1","0.000000","192.168.100.102","192.168.100.1","TCP","54","64383  >  8888 [ACK] Seq=1 Ack=1 Win=21372 Len=0"
"2","0.002816","192.168.100.1","192.168.100.102","TCP","174","8888  >  64383 [PSH, ACK] Seq=1 Ack=1 Win=1825 Len=120"
"3","0.045795","192.168.100.102","192.168.100.1","TCP","54","64383  >  8888 [ACK] Seq=1 Ack=121 Win=21252 Len=0"
"4","0.048663","192.168.100.1","192.168.100.102","TCP","134","8888  >  64383 [PSH, ACK] Seq=121 Ack=1 Win=1825 Len=80"
"5","0.092667","192.168.100.102","192.168.100.1","TCP","54","64383  >  8888 [ACK] Seq=1 Ack=201 Win=21172 Len=0"
"6","0.095707","192.168.100.1","192.168.100.102","TCP","134","8888  >  64383 [PSH, ACK] Seq=201 Ack=1 Win=1825 Len=80"
"7","0.140145","192.168.100.102","192.168.100.1","TCP","54","64383  >  8888 [ACK] Seq=1 Ack=281 Win=21092 Len=0"
"8","0.148192","192.168.100.1","192.168.100.102","TCP","174","8888  >  64383 [PSH, ACK] Seq=281 Ack=1 Win=1825 Len=120"
"9","0.201249","192.168.100.102","192.168.100.1","TCP","54","64383  >  8888 [ACK] Seq=1 Ack=401 Win=20972 Len=0"
"10","0.205146","192.168.100.1","192.168.100.102","TCP","134","8888  >  64383 [PSH, ACK] Seq=401 Ack=1 Win=1825 Len=80"
"11","0.247053","192.168.100.102","192.168.100.1","TCP","54","64383  >  8888 [ACK] Seq=1 Ack=481 Win=20892 Len=0"
"12","0.358600","192.168.100.1","192.168.100.102","ICMP","98","Echo (ping) request  id=0xd849, seq=0/0, ttl=64 (reply in 13)"
"13","0.358926","192.168.100.102","192.168.100.1","ICMP","98","Echo (ping) reply    id=0xd849, seq=0/0, ttl=128 (request in 12)"
"14","0.424811","192.168.100.1","192.168.100.255","UDP","86","46573  >  8668 Len=44"
"15","0.458191","192.168.100.1","192.168.100.102","TCP","574","8888  >  64383 [PSH, ACK] Seq=481 Ack=1 Win=1825 Len=520"
"16","0.508376","192.168.100.102","192.168.100.1","TCP","54","64383  >  8888 [ACK] Seq=1 Ack=1001 Win=20372 Len=0"
"17","0.511779","192.168.100.1","192.168.100.102","TCP","174","8888  >  64383 [PSH, ACK] Seq=1001 Ack=1 Win=1825 Len=120"
"18","0.554648","192.168.100.102","192.168.100.1","TCP","54","64383  >  8888 [ACK] Seq=1 Ack=1121 Win=20252 Len=0"
"19","0.557613","192.168.100.1","192.168.100.102","TCP","238","8888  >  64383 [PSH, ACK] Seq=1121 Ack=1 Win=1825 Len=184"
"20","0.601317","192.168.100.102","192.168.100.1","TCP","54","64383  >  8888 [ACK] Seq=1 Ack=1305 Win=20068 Len=0"
"21","0.604481","192.168.100.1","192.168.100.102","TCP","134","8888  >  64383 [PSH, ACK] Seq=1305 Ack=1 Win=1825 Len=80"
"22","0.647987","192.168.100.102","192.168.100.1","TCP","54","64383  >  8888 [ACK] Seq=1 Ack=1385 Win=19988 Len=0"
"23","0.651137","192.168.100.1","192.168.100.102","TCP","174","8888  >  64383 [PSH, ACK] Seq=1385 Ack=1 Win=1825 Len=120"
"24","0.694973","192.168.100.102","192.168.100.1","TCP","54","64383  >  8888 [ACK] Seq=1 Ack=1505 Win=19868 Len=0"
"25","0.697635","192.168.100.1","192.168.100.102","TCP","134","8888  >  64383 [PSH, ACK] Seq=1505 Ack=1 Win=1825 Len=80"
"26","0.742274","192.168.100.102","192.168.100.1","TCP","54","64383  >  8888 [ACK] Seq=1 Ack=1585 Win=19788 Len=0"
"27","0.745268","192.168.100.1","192.168.100.102","TCP","134","8888  >  64383 [PSH, ACK] Seq=1585 Ack=1 Win=1825 Len=80"
"28","0.788286","192.168.100.102","192.168.100.1","TCP","54","64383  >  8888 [ACK] Seq=1 Ack=1665 Win=19708 Len=0"
"29","0.791102","192.168.100.1","192.168.100.102","TCP","174","8888  >  64383 [PSH, ACK] Seq=1665 Ack=1 Win=1825 Len=120"
"30","0.834403","192.168.100.102","192.168.100.1","TCP","54","64383  >  8888 [ACK] Seq=1 Ack=1785 Win=19588 Len=0"
"31","0.837290","192.168.100.1","192.168.100.102","TCP","134","8888  >  64383 [PSH, ACK] Seq=1785 Ack=1 Win=1825 Len=80"
"32","0.880963","192.168.100.102","192.168.100.1","TCP","54","64383  >  8888 [ACK] Seq=1 Ack=1865 Win=19508 Len=0"
"33","0.884133","192.168.100.1","192.168.100.102","TCP","240","8888  >  64383 [PSH, ACK] Seq=1865 Ack=1 Win=1825 Len=186"
"34","0.927423","192.168.100.102","192.168.100.1","TCP","54","64383  >  8888 [ACK] Seq=1 Ack=2051 Win=19322 Len=0"
"35","0.930290","192.168.100.1","192.168.100.102","TCP","174","8888  >  64383 [PSH, ACK] Seq=2051 Ack=1 Win=1825 Len=120"
"36","0.973066","192.168.100.102","192.168.100.1","TCP","54","64383  >  8888 [ACK] Seq=1 Ack=2171 Win=19202 Len=0"
"37","0.976286","192.168.100.1","192.168.100.102","TCP","134","8888  >  64383 [PSH, ACK] Seq=2171 Ack=1 Win=1825 Len=80"
"38","1.020633","192.168.100.102","192.168.100.1","TCP","54","64383  >  8888 [ACK] Seq=1 Ack=2251 Win=19122 Len=0"
"39","1.024416","192.168.100.1","192.168.100.102","TCP","134","8888  >  64383 [PSH, ACK] Seq=2251 Ack=1 Win=1825 Len=80"
"40","1.066534","192.168.100.102","192.168.100.1","TCP","54","64383  >  8888 [ACK] Seq=1 Ack=2331 Win=19042 Len=0"
"41","1.069347","192.168.100.1","192.168.100.102","TCP","174","8888  >  64383 [PSH, ACK] Seq=2331 Ack=1 Win=1825 Len=120"
"42","1.113240","192.168.100.102","192.168.100.1","TCP","54","64383  >  8888 [ACK] Seq=1 Ack=2451 Win=18922 Len=0"
"43","1.122962","192.168.100.1","192.168.100.102","TCP","134","8888  >  64383 [PSH, ACK] Seq=2451 Ack=1 Win=1825 Len=80"
"44","1.175926","192.168.100.102","192.168.100.1","TCP","54","64383  >  8888 [ACK] Seq=1 Ack=2531 Win=18842 Len=0"
"45","1.178869","192.168.100.1","192.168.100.102","TCP","174","8888  >  64383 [PSH, ACK] Seq=2531 Ack=1 Win=1825 Len=120"
"46","1.222648","192.168.100.102","192.168.100.1","TCP","54","64383  >  8888 [ACK] Seq=1 Ack=2651 Win=18722 Len=0"
"47","1.225613","192.168.100.1","192.168.100.102","TCP","134","8888  >  64383 [PSH, ACK] Seq=2651 Ack=1 Win=1825 Len=80"
"48","1.269728","192.168.100.102","192.168.100.1","TCP","54","64383  >  8888 [ACK] Seq=1 Ack=2731 Win=18642 Len=0"
"49","1.272656","192.168.100.1","192.168.100.102","TCP","174","8888  >  64383 [PSH, ACK] Seq=2731 Ack=1 Win=1825 Len=120"
"50","1.316094","192.168.100.102","192.168.100.1","TCP","54","64383  >  8888 [ACK] Seq=1 Ack=2851 Win=18522 Len=0"
"51","1.321516","192.168.100.1","192.168.100.102","TCP","134","8888  >  64383 [PSH, ACK] Seq=2851 Ack=1 Win=1825 Len=80"
"52","1.361980","192.168.100.102","192.168.100.1","TCP","54","64383  >  8888 [ACK] Seq=1 Ack=2931 Win=18442 Len=0"
"53","1.365149","192.168.100.1","192.168.100.102","TCP","134","8888  >  64383 [PSH, ACK] Seq=2931 Ack=1 Win=1825 Len=80"
"54","1.408410","192.168.100.102","192.168.100.1","TCP","54","64383  >  8888 [ACK] Seq=1 Ack=3011 Win=18362 Len=0"
"55","1.414171","192.168.100.1","192.168.100.102","TCP","174","8888  >  64383 [PSH, ACK] Seq=3011 Ack=1 Win=1825 Len=120"
"56","1.469388","192.168.100.102","192.168.100.1","TCP","54","64383  >  8888 [ACK] Seq=1 Ack=3131 Win=18242 Len=0"
"57","1.558653","192.168.100.1","192.168.100.102","ICMP","98","Echo (ping) request  id=0xf849, seq=0/0, ttl=64 (reply in 58)"
"58","1.559219","192.168.100.102","192.168.100.1","ICMP","98","Echo (ping) reply    id=0xf849, seq=0/0, ttl=128 (request in 57)"
"59","1.666172","192.168.100.1","192.168.100.102","TCP","638","8888  >  64383 [PSH, ACK] Seq=3131 Ack=1 Win=1825 Len=584"
"60","1.718087","192.168.100.102","192.168.100.1","TCP","54","64383  >  8888 [ACK] Seq=1 Ack=3715 Win=17658 Len=0"
"61","1.721044","192.168.100.1","192.168.100.102","TCP","174","8888  >  64383 [PSH, ACK] Seq=3715 Ack=1 Win=1825 Len=120"
"62","1.764910","192.168.100.102","192.168.100.1","TCP","54","64383  >  8888 [ACK] Seq=1 Ack=3835 Win=17538 Len=0"
"63","1.767692","192.168.100.1","192.168.100.102","TCP","134","8888  >  64383 [PSH, ACK] Seq=3835 Ack=1 Win=1825 Len=80"
"64","1.810896","192.168.100.102","192.168.100.1","TCP","54","64383  >  8888 [ACK] Seq=1 Ack=3915 Win=17458 Len=0"
"65","1.815022","192.168.100.1","192.168.100.102","TCP","174","8888  >  64383 [PSH, ACK] Seq=3915 Ack=1 Win=1825 Len=120"
"66","1.857597","192.168.100.102","192.168.100.1","TCP","54","64383  >  8888 [ACK] Seq=1 Ack=4035 Win=17338 Len=0"
"67","1.860542","192.168.100.1","192.168.100.102","TCP","240","8888  >  64383 [PSH, ACK] Seq=4035 Ack=1 Win=1825 Len=186"
"68","1.903693","192.168.100.102","192.168.100.1","TCP","54","64383  >  8888 [ACK] Seq=1 Ack=4221 Win=17152 Len=0"
"69","1.906961","192.168.100.1","192.168.100.102","TCP","134","8888  >  64383 [PSH, ACK] Seq=4221 Ack=1 Win=1825 Len=80"
"70","1.950659","192.168.100.102","192.168.100.1","TCP","54","64383  >  8888 [ACK] Seq=1 Ack=4301 Win=17072 Len=0"
"71","1.955358","192.168.100.1","192.168.100.102","TCP","174","8888  >  64383 [PSH, ACK] Seq=4301 Ack=1 Win=1825 Len=120"
"72","1.997249","192.168.100.102","192.168.100.1","TCP","54","64383  >  8888 [ACK] Seq=1 Ack=4421 Win=16952 Len=0"
"73","2.000217","192.168.100.1","192.168.100.102","TCP","134","8888  >  64383 [PSH, ACK] Seq=4421 Ack=1 Win=1825 Len=80"
"74","2.043156","192.168.100.102","192.168.100.1","TCP","54","64383  >  8888 [ACK] Seq=1 Ack=4501 Win=16872 Len=0"
"75","2.045957","192.168.100.1","192.168.100.102","TCP","134","8888  >  64383 [PSH, ACK] Seq=4501 Ack=1 Win=1825 Len=80"
"76","2.089576","192.168.100.102","192.168.100.1","TCP","54","64383  >  8888 [ACK] Seq=1 Ack=4581 Win=16792 Len=0"
"77","2.093749","192.168.100.1","192.168.100.102","TCP","174","8888  >  64383 [PSH, ACK] Seq=4581 Ack=1 Win=1825 Len=120"
"78","2.135990","192.168.100.102","192.168.100.1","TCP","54","64383  >  8888 [ACK] Seq=1 Ack=4701 Win=16672 Len=0"
"79","2.139163","192.168.100.1","192.168.100.102","TCP","134","8888  >  64383 [PSH, ACK] Seq=4701 Ack=1 Win=1825 Len=80"
"80","2.182851","192.168.100.102","192.168.100.1","TCP","54","64383  >  8888 [ACK] Seq=1 Ack=4781 Win=16592 Len=0"
"81","2.185979","192.168.100.1","192.168.100.102","TCP","134","8888  >  64383 [PSH, ACK] Seq=4781 Ack=1 Win=1825 Len=80"
"82","2.229537","192.168.100.102","192.168.100.1","TCP","54","64383  >  8888 [ACK] Seq=1 Ack=4861 Win=16512 Len=0"
"83","2.232584","192.168.100.1","192.168.100.102","TCP","134","8888  >  64383 [PSH, ACK] Seq=4861 Ack=1 Win=1825 Len=80"
"84","2.275723","192.168.100.102","192.168.100.1","TCP","54","64383  >  8888 [ACK] Seq=1 Ack=4941 Win=16432 Len=0"
"85","2.278445","192.168.100.1","192.168.100.102","TCP","174","8888  >  64383 [PSH, ACK] Seq=4941 Ack=1 Win=1825 Len=120"
"86","2.323274","192.168.100.102","192.168.100.1","TCP","54","64383  >  8888 [ACK] Seq=1 Ack=5061 Win=16312 Len=0"
"87","2.326402","192.168.100.1","192.168.100.102","TCP","134","8888  >  64383 [PSH, ACK] Seq=5061 Ack=1 Win=1825 Len=80"
"88","2.369151","192.168.100.102","192.168.100.1","TCP","54","64383  >  8888 [ACK] Seq=1 Ack=5141 Win=16232 Len=0"
"89","2.372136","192.168.100.1","192.168.100.102","TCP","134","8888  >  64383 [PSH, ACK] Seq=5141 Ack=1 Win=1825 Len=80"
"90","2.415338","192.168.100.102","192.168.100.1","TCP","54","64383  >  8888 [ACK] Seq=1 Ack=5221 Win=16152 Len=0"
"91","2.418190","192.168.100.1","192.168.100.102","TCP","174","8888  >  64383 [PSH, ACK] Seq=5221 Ack=1 Win=1825 Len=120"
"92","2.461009","192.168.100.102","192.168.100.1","TCP","54","64383  >  8888 [ACK] Seq=1 Ack=5341 Win=16032 Len=0"
"93","2.465966","192.168.100.1","192.168.100.102","TCP","134","8888  >  64383 [PSH, ACK] Seq=5341 Ack=1 Win=1825 Len=80"
"94","2.506936","192.168.100.102","192.168.100.1","TCP","54","64383  >  8888 [ACK] Seq=1 Ack=5421 Win=15952 Len=0"
"95","2.509990","192.168.100.1","192.168.100.102","TCP","134","8888  >  64383 [PSH, ACK] Seq=5421 Ack=1 Win=1825 Len=80"
"96","2.552392","192.168.100.102","192.168.100.1","TCP","54","64383  >  8888 [ACK] Seq=1 Ack=5501 Win=15872 Len=0"
"97","2.555082","192.168.100.1","192.168.100.102","TCP","134","8888  >  64383 [PSH, ACK] Seq=5501 Ack=1 Win=1825 Len=80"
"98","2.598334","192.168.100.102","192.168.100.1","TCP","54","64383  >  8888 [ACK] Seq=1 Ack=5581 Win=15792 Len=0"
"99","2.603738","192.168.100.1","192.168.100.102","TCP","278","8888  >  64383 [PSH, ACK] Seq=5581 Ack=1 Win=1825 Len=224"
"100","2.657990","192.168.100.102","192.168.100.1","TCP","54","64383  >  8888 [ACK] Seq=1 Ack=5805 Win=15568 Len=0"
"101","2.753903","192.168.100.1","192.168.100.102","ICMP","98","Echo (ping) request  id=0x194a, seq=0/0, ttl=64 (reply in 102)"
"102","2.754358","192.168.100.102","192.168.100.1","ICMP","98","Echo (ping) reply    id=0x194a, seq=0/0, ttl=128 (request in 101)"
"103","2.809589","192.168.100.1","192.168.100.255","UDP","86","46573  >  8668 Len=44"
"104","2.855083","192.168.100.1","192.168.100.102","TCP","640","8888  >  64383 [PSH, ACK] Seq=5805 Ack=1 Win=1825 Len=586"
"105","2.905115","192.168.100.102","192.168.100.1","TCP","54","64383  >  8888 [ACK] Seq=1 Ack=6391 Win=14982 Len=0"
"106","2.908000","192.168.100.1","192.168.100.102","TCP","174","8888  >  64383 [PSH, ACK] Seq=6391 Ack=1 Win=1825 Len=120"
"107","2.950566","192.168.100.102","192.168.100.1","TCP","54","64383  >  8888 [ACK] Seq=1 Ack=6511 Win=14862 Len=0"
"108","2.954672","192.168.100.1","192.168.100.102","TCP","134","8888  >  64383 [PSH, ACK] Seq=6511 Ack=1 Win=1825 Len=80"
"109","2.997598","192.168.100.102","192.168.100.1","TCP","54","64383  >  8888 [ACK] Seq=1 Ack=6591 Win=14782 Len=0"
"110","3.000594","192.168.100.1","192.168.100.102","TCP","174","8888  >  64383 [PSH, ACK] Seq=6591 Ack=1 Win=1825 Len=120"
"111","3.044395","192.168.100.102","192.168.100.1","TCP","54","64383  >  8888 [ACK] Seq=1 Ack=6711 Win=14662 Len=0"
"112","3.049106","192.168.100.1","192.168.100.102","TCP","134","8888  >  64383 [PSH, ACK] Seq=6711 Ack=1 Win=1825 Len=80"
"113","3.090696","192.168.100.102","192.168.100.1","TCP","54","64383  >  8888 [ACK] Seq=1 Ack=6791 Win=14582 Len=0"
"114","3.094209","192.168.100.1","192.168.100.102","TCP","134","8888  >  64383 [PSH, ACK] Seq=6791 Ack=1 Win=1825 Len=80"
"115","3.137392","192.168.100.102","192.168.100.1","TCP","54","64383  >  8888 [ACK] Seq=1 Ack=6871 Win=14502 Len=0"
"116","3.140449","192.168.100.1","192.168.100.102","TCP","174","8888  >  64383 [PSH, ACK] Seq=6871 Ack=1 Win=1825 Len=120"
"117","3.183315","192.168.100.102","192.168.100.1","TCP","54","64383  >  8888 [ACK] Seq=1 Ack=6991 Win=14382 Len=0"
"118","3.186141","192.168.100.1","192.168.100.102","TCP","134","8888  >  64383 [PSH, ACK] Seq=6991 Ack=1 Win=1825 Len=80"
"119","3.229229","192.168.100.102","192.168.100.1","TCP","54","64383  >  8888 [ACK] Seq=1 Ack=7071 Win=14302 Len=0"
"120","3.232643","192.168.100.1","192.168.100.102","TCP","134","8888  >  64383 [PSH, ACK] Seq=7071 Ack=1 Win=1825 Len=80"
"121","3.274945","192.168.100.102","192.168.100.1","TCP","54","64383  >  8888 [ACK] Seq=1 Ack=7151 Win=14222 Len=0"
"122","3.278245","192.168.100.1","192.168.100.102","TCP","134","8888  >  64383 [PSH, ACK] Seq=7151 Ack=1 Win=1825 Len=80"
"123","3.320856","192.168.100.102","192.168.100.1","TCP","54","64383  >  8888 [ACK] Seq=1 Ack=7231 Win=14142 Len=0"
"124","3.326056","192.168.100.1","192.168.100.102","TCP","174","8888  >  64383 [PSH, ACK] Seq=7231 Ack=1 Win=1825 Len=120"
"125","3.367062","192.168.100.102","192.168.100.1","TCP","54","64383  >  8888 [ACK] Seq=1 Ack=7351 Win=14022 Len=0"
"126","3.370024","192.168.100.1","192.168.100.102","TCP","134","8888  >  64383 [PSH, ACK] Seq=7351 Ack=1 Win=1825 Len=80"
"127","3.413858","192.168.100.102","192.168.100.1","TCP","54","64383  >  8888 [ACK] Seq=1 Ack=7431 Win=13942 Len=0"
"128","3.416476","192.168.100.1","192.168.100.102","TCP","134","8888  >  64383 [PSH, ACK] Seq=7431 Ack=1 Win=1825 Len=80"
"129","3.459293","192.168.100.102","192.168.100.1","TCP","54","64383  >  8888 [ACK] Seq=1 Ack=7511 Win=13862 Len=0"
"130","3.462942","192.168.100.1","192.168.100.102","TCP","174","8888  >  64383 [PSH, ACK] Seq=7511 Ack=1 Win=1825 Len=120"
"131","3.506256","192.168.100.102","192.168.100.1","TCP","54","64383  >  8888 [ACK] Seq=1 Ack=7631 Win=13742 Len=0"
"132","3.510646","192.168.100.1","192.168.100.102","TCP","134","8888  >  64383 [PSH, ACK] Seq=7631 Ack=1 Win=1825 Len=80"
"133","3.554095","192.168.100.102","192.168.100.1","TCP","54","64383  >  8888 [ACK] Seq=1 Ack=7711 Win=13662 Len=0"
"134","3.556874","192.168.100.1","192.168.100.102","TCP","134","8888  >  64383 [PSH, ACK] Seq=7711 Ack=1 Win=1825 Len=80"
"135","3.601956","192.168.100.102","192.168.100.1","TCP","54","64383  >  8888 [ACK] Seq=1 Ack=7791 Win=13582 Len=0"
"136","3.604940","192.168.100.1","192.168.100.102","TCP","174","8888  >  64383 [PSH, ACK] Seq=7791 Ack=1 Win=1825 Len=120"
"137","3.649888","192.168.100.102","192.168.100.1","TCP","54","64383  >  8888 [ACK] Seq=1 Ack=7911 Win=13462 Len=0"
"138","3.654120","192.168.100.1","192.168.100.102","TCP","238","8888  >  64383 [PSH, ACK] Seq=7911 Ack=1 Win=1825 Len=184"
"139","3.695943","192.168.100.102","192.168.100.1","TCP","54","64383  >  8888 [ACK] Seq=1 Ack=8095 Win=13278 Len=0"
"140","3.698639","192.168.100.1","192.168.100.102","TCP","134","8888  >  64383 [PSH, ACK] Seq=8095 Ack=1 Win=1825 Len=80"
"141","3.741836","192.168.100.102","192.168.100.1","TCP","54","64383  >  8888 [ACK] Seq=1 Ack=8175 Win=13198 Len=0"
"142","3.745019","192.168.100.1","192.168.100.102","TCP","174","8888  >  64383 [PSH, ACK] Seq=8175 Ack=1 Win=1825 Len=120"
"143","3.787991","192.168.100.102","192.168.100.1","TCP","54","64383  >  8888 [ACK] Seq=1 Ack=8295 Win=13078 Len=0"
"144","3.791710","192.168.100.1","192.168.100.102","TCP","134","8888  >  64383 [PSH, ACK] Seq=8295 Ack=1 Win=1825 Len=80"
"145","3.832627","192.168.100.102","192.168.100.1","TCP","54","64383  >  8888 [ACK] Seq=1 Ack=8375 Win=12998 Len=0"
"146","3.835627","192.168.100.1","192.168.100.102","TCP","134","8888  >  64383 [PSH, ACK] Seq=8375 Ack=1 Win=1825 Len=80"
"147","3.879414","192.168.100.102","192.168.100.1","TCP","54","64383  >  8888 [ACK] Seq=1 Ack=8455 Win=12918 Len=0"
"148","3.974096","192.168.100.1","192.168.100.102","ICMP","98","Echo (ping) request  id=0x394a, seq=0/0, ttl=64 (reply in 149)"
"149","3.974590","192.168.100.102","192.168.100.1","ICMP","98","Echo (ping) reply    id=0x394a, seq=0/0, ttl=128 (request in 148)"
"150","4.030189","192.168.100.1","192.168.100.255","UDP","86","46573  >  8668 Len=44"
"151","4.087189","192.168.100.1","192.168.100.102","TCP","680","8888  >  64383 [PSH, ACK] Seq=8455 Ack=1 Win=1825 Len=626"
"152","4.128264","192.168.100.102","192.168.100.1","TCP","54","64383  >  8888 [ACK] Seq=1 Ack=9081 Win=12292 Len=0"
"153","4.131521","192.168.100.1","192.168.100.102","TCP","134","8888  >  64383 [PSH, ACK] Seq=9081 Ack=1 Win=1825 Len=80"
"154","4.175064","192.168.100.102","192.168.100.1","TCP","54","64383  >  8888 [ACK] Seq=1 Ack=9161 Win=12212 Len=0"
"155","4.178427","192.168.100.1","192.168.100.102","TCP","134","8888  >  64383 [PSH, ACK] Seq=9161 Ack=1 Win=1825 Len=80"
"156","4.221497","192.168.100.102","192.168.100.1","TCP","54","64383  >  8888 [ACK] Seq=1 Ack=9241 Win=12132 Len=0"
"157","4.225513","192.168.100.1","192.168.100.102","TCP","174","8888  >  64383 [PSH, ACK] Seq=9241 Ack=1 Win=1825 Len=120"
"158","4.267216","192.168.100.102","192.168.100.1","TCP","54","64383  >  8888 [ACK] Seq=1 Ack=9361 Win=12012 Len=0"
"159","4.270693","192.168.100.1","192.168.100.102","TCP","94","8888  >  64383 [PSH, ACK] Seq=9361 Ack=1 Win=1825 Len=40"
"160","4.312761","192.168.100.102","192.168.100.1","TCP","54","64383  >  8888 [ACK] Seq=1 Ack=9401 Win=11972 Len=0"
"161","4.315776","192.168.100.1","192.168.100.102","TCP","174","8888  >  64383 [PSH, ACK] Seq=9401 Ack=1 Win=1825 Len=120"
"162","4.359423","192.168.100.102","192.168.100.1","TCP","54","64383  >  8888 [ACK] Seq=1 Ack=9521 Win=11852 Len=0"
"163","4.362693","192.168.100.1","192.168.100.102","TCP","134","8888  >  64383 [PSH, ACK] Seq=9521 Ack=1 Win=1825 Len=80"
"164","4.406292","192.168.100.102","192.168.100.1","TCP","54","64383  >  8888 [ACK] Seq=1 Ack=9601 Win=11772 Len=0"
"165","4.409196","192.168.100.1","192.168.100.102","TCP","174","8888  >  64383 [PSH, ACK] Seq=9601 Ack=1 Win=1825 Len=120"
"166","4.452202","192.168.100.102","192.168.100.1","TCP","54","64383  >  8888 [ACK] Seq=1 Ack=9721 Win=11652 Len=0"
"167","4.455128","192.168.100.1","192.168.100.102","TCP","134","8888  >  64383 [PSH, ACK] Seq=9721 Ack=1 Win=1825 Len=80"
"168","4.498433","192.168.100.102","192.168.100.1","TCP","54","64383  >  8888 [ACK] Seq=1 Ack=9801 Win=11572 Len=0"
"169","4.501930","192.168.100.1","192.168.100.102","TCP","134","8888  >  64383 [PSH, ACK] Seq=9801 Ack=1 Win=1825 Len=80"
"170","4.545319","192.168.100.102","192.168.100.1","TCP","54","64383  >  8888 [ACK] Seq=1 Ack=9881 Win=11492 Len=0"
"171","4.549336","192.168.100.1","192.168.100.102","TCP","174","8888  >  64383 [PSH, ACK] Seq=9881 Ack=1 Win=1825 Len=120"
"172","4.591797","192.168.100.102","192.168.100.1","TCP","54","64383  >  8888 [ACK] Seq=1 Ack=10001 Win=11372 Len=0"
"173","4.594750","192.168.100.1","192.168.100.102","TCP","134","8888  >  64383 [PSH, ACK] Seq=10001 Ack=1 Win=1825 Len=80"
"174","4.638631","192.168.100.102","192.168.100.1","TCP","54","64383  >  8888 [ACK] Seq=1 Ack=10081 Win=11292 Len=0"
"175","4.641729","192.168.100.1","192.168.100.102","TCP","238","8888  >  64383 [PSH, ACK] Seq=10081 Ack=1 Win=1825 Len=184"
"176","4.684518","192.168.100.102","192.168.100.1","TCP","54","64383  >  8888 [ACK] Seq=1 Ack=10265 Win=11108 Len=0"
"177","4.688420","192.168.100.1","192.168.100.102","TCP","174","8888  >  64383 [PSH, ACK] Seq=10265 Ack=1 Win=1825 Len=120"
"178","4.730524","192.168.100.102","192.168.100.1","TCP","54","64383  >  8888 [ACK] Seq=1 Ack=10385 Win=10988 Len=0"
"179","4.734618","192.168.100.1","192.168.100.102","TCP","134","8888  >  64383 [PSH, ACK] Seq=10385 Ack=1 Win=1825 Len=80"
"180","4.776503","192.168.100.102","192.168.100.1","TCP","54","64383  >  8888 [ACK] Seq=1 Ack=10465 Win=10908 Len=0"
"181","4.779995","192.168.100.1","192.168.100.102","TCP","134","8888  >  64383 [PSH, ACK] Seq=10465 Ack=1 Win=1825 Len=80"
"182","4.822850","192.168.100.102","192.168.100.1","TCP","54","64383  >  8888 [ACK] Seq=1 Ack=10545 Win=10828 Len=0"
"183","4.825625","192.168.100.1","192.168.100.102","TCP","174","8888  >  64383 [PSH, ACK] Seq=10545 Ack=1 Win=1825 Len=120"
"184","4.868664","192.168.100.102","192.168.100.1","TCP","54","64383  >  8888 [ACK] Seq=1 Ack=10665 Win=10708 Len=0"
"185","4.871590","192.168.100.1","192.168.100.102","TCP","240","8888  >  64383 [PSH, ACK] Seq=10665 Ack=1 Win=1825 Len=186"
"186","4.915486","192.168.100.102","192.168.100.1","TCP","54","64383  >  8888 [ACK] Seq=1 Ack=10851 Win=10522 Len=0"
"187","4.918477","192.168.100.1","192.168.100.102","TCP","134","8888  >  64383 [PSH, ACK] Seq=10851 Ack=1 Win=1825 Len=80"
"188","4.966130","192.168.100.102","192.168.100.1","TCP","54","64383  >  8888 [ACK] Seq=1 Ack=10931 Win=10442 Len=0"
"189","4.969336","192.168.100.1","192.168.100.102","TCP","174","8888  >  64383 [PSH, ACK] Seq=10931 Ack=1 Win=1825 Len=120"
"190","5.023626","192.168.100.102","192.168.100.1","TCP","54","64383  >  8888 [ACK] Seq=1 Ack=11051 Win=10322 Len=0"
"191","5.027054","192.168.100.1","192.168.100.102","TCP","134","8888  >  64383 [PSH, ACK] Seq=11051 Ack=1 Win=1825 Len=80"
"192","5.070047","192.168.100.102","192.168.100.1","TCP","54","64383  >  8888 [ACK] Seq=1 Ack=11131 Win=10242 Len=0"
"193","5.181823","192.168.100.1","192.168.100.102","ICMP","98","Echo (ping) request  id=0x594a, seq=0/0, ttl=64 (reply in 194)"
"194","5.182211","192.168.100.102","192.168.100.1","ICMP","98","Echo (ping) reply    id=0x594a, seq=0/0, ttl=128 (request in 193)"
"195","5.237026","192.168.100.1","192.168.100.255","UDP","86","46573  >  8668 Len=44"
"196","5.280020","192.168.100.1","192.168.100.102","TCP","574","8888  >  64383 [PSH, ACK] Seq=11131 Ack=1 Win=1825 Len=520"
"197","5.333735","192.168.100.102","192.168.100.1","TCP","54","64383  >  8888 [ACK] Seq=1 Ack=11651 Win=9722 Len=0"
"198","5.339814","192.168.100.1","192.168.100.102","TCP","174","8888  >  64383 [PSH, ACK] Seq=11651 Ack=1 Win=1825 Len=120"
"199","5.381226","192.168.100.102","192.168.100.1","TCP","54","64383  >  8888 [ACK] Seq=1 Ack=11771 Win=9602 Len=0"
"200","5.384314","192.168.100.1","192.168.100.102","TCP","134","8888  >  64383 [PSH, ACK] Seq=11771 Ack=1 Win=1825 Len=80"
"201","5.427702","192.168.100.102","192.168.100.1","TCP","54","64383  >  8888 [ACK] Seq=1 Ack=11851 Win=9522 Len=0"
"202","5.430525","192.168.100.1","192.168.100.102","TCP","134","8888  >  64383 [PSH, ACK] Seq=11851 Ack=1 Win=1825 Len=80"
"203","5.473851","192.168.100.102","192.168.100.1","TCP","54","64383  >  8888 [ACK] Seq=1 Ack=11931 Win=9442 Len=0"
"204","5.476559","192.168.100.1","192.168.100.102","TCP","174","8888  >  64383 [PSH, ACK] Seq=11931 Ack=1 Win=1825 Len=120"
"205","5.520462","192.168.100.102","192.168.100.1","TCP","54","64383  >  8888 [ACK] Seq=1 Ack=12051 Win=9322 Len=0"
"206","5.523440","192.168.100.1","192.168.100.102","TCP","134","8888  >  64383 [PSH, ACK] Seq=12051 Ack=1 Win=1825 Len=80"
"207","5.565903","192.168.100.102","192.168.100.1","TCP","54","64383  >  8888 [ACK] Seq=1 Ack=12131 Win=9242 Len=0"
"208","5.572270","192.168.100.1","192.168.100.102","TCP","134","8888  >  64383 [PSH, ACK] Seq=12131 Ack=1 Win=1825 Len=80"
"209","5.613043","192.168.100.102","192.168.100.1","TCP","54","64383  >  8888 [ACK] Seq=1 Ack=12211 Win=9162 Len=0"
"210","5.615609","192.168.100.1","192.168.100.102","TCP","174","8888  >  64383 [PSH, ACK] Seq=12211 Ack=1 Win=1825 Len=120"
"211","5.659972","192.168.100.102","192.168.100.1","TCP","54","64383  >  8888 [ACK] Seq=1 Ack=12331 Win=9042 Len=0"
"212","5.663001","192.168.100.1","192.168.100.102","TCP","238","8888  >  64383 [PSH, ACK] Seq=12331 Ack=1 Win=1825 Len=184"
"213","5.705825","192.168.100.102","192.168.100.1","TCP","54","64383  >  8888 [ACK] Seq=1 Ack=12515 Win=8858 Len=0"
"214","5.709235","192.168.100.1","192.168.100.102","TCP","134","8888  >  64383 [PSH, ACK] Seq=12515 Ack=1 Win=1825 Len=80"
"215","5.752124","192.168.100.102","192.168.100.1","TCP","54","64383  >  8888 [ACK] Seq=1 Ack=12595 Win=8778 Len=0"
"216","5.754992","192.168.100.1","192.168.100.102","TCP","174","8888  >  64383 [PSH, ACK] Seq=12595 Ack=1 Win=1825 Len=120"
"217","5.799890","192.168.100.102","192.168.100.1","TCP","54","64383  >  8888 [ACK] Seq=1 Ack=12715 Win=8658 Len=0"
"218","5.804535","192.168.100.1","192.168.100.102","TCP","134","8888  >  64383 [PSH, ACK] Seq=12715 Ack=1 Win=1825 Len=80"
"219","5.846895","192.168.100.102","192.168.100.1","TCP","54","64383  >  8888 [ACK] Seq=1 Ack=12795 Win=8578 Len=0"
"220","5.849903","192.168.100.1","192.168.100.102","TCP","280","8888  >  64383 [PSH, ACK] Seq=12795 Ack=1 Win=1825 Len=226"
"221","5.892318","192.168.100.102","192.168.100.1","TCP","54","64383  >  8888 [ACK] Seq=1 Ack=13021 Win=8352 Len=0"
"222","5.895249","192.168.100.1","192.168.100.102","TCP","134","8888  >  64383 [PSH, ACK] Seq=13021 Ack=1 Win=1825 Len=80"
"223","5.939863","192.168.100.102","192.168.100.1","TCP","54","64383  >  8888 [ACK] Seq=1 Ack=13101 Win=8272 Len=0"
"224","5.943113","192.168.100.1","192.168.100.102","TCP","134","8888  >  64383 [PSH, ACK] Seq=13101 Ack=1 Win=1825 Len=80"
"225","5.986189","192.168.100.102","192.168.100.1","TCP","54","64383  >  8888 [ACK] Seq=1 Ack=13181 Win=8192 Len=0"
"226","5.989101","192.168.100.1","192.168.100.102","TCP","134","8888  >  64383 [PSH, ACK] Seq=13181 Ack=1 Win=1825 Len=80"
"227","6.031478","192.168.100.102","192.168.100.1","TCP","54","64383  >  8888 [ACK] Seq=1 Ack=13261 Win=8112 Len=0"
"228","6.034328","192.168.100.1","192.168.100.102","TCP","174","8888  >  64383 [PSH, ACK] Seq=13261 Ack=1 Win=1825 Len=120"
"229","6.077714","192.168.100.102","192.168.100.1","TCP","54","64383  >  8888 [ACK] Seq=1 Ack=13381 Win=7992 Len=0"
"230","6.083908","192.168.100.1","192.168.100.102","TCP","134","8888  >  64383 [PSH, ACK] Seq=13381 Ack=1 Win=1825 Len=80"
"231","6.124145","192.168.100.102","192.168.100.1","TCP","54","64383  >  8888 [ACK] Seq=1 Ack=13461 Win=7912 Len=0"
"232","6.126985","192.168.100.1","192.168.100.102","TCP","134","8888  >  64383 [PSH, ACK] Seq=13461 Ack=1 Win=1825 Len=80"
"233","6.171069","192.168.100.102","192.168.100.1","TCP","54","64383  >  8888 [ACK] Seq=1 Ack=13541 Win=7832 Len=0"
"234","6.174386","192.168.100.1","192.168.100.102","TCP","174","8888  >  64383 [PSH, ACK] Seq=13541 Ack=1 Win=1825 Len=120"
"235","6.217195","192.168.100.102","192.168.100.1","TCP","54","64383  >  8888 [ACK] Seq=1 Ack=13661 Win=7712 Len=0"
"236","6.220110","192.168.100.1","192.168.100.102","TCP","134","8888  >  64383 [PSH, ACK] Seq=13661 Ack=1 Win=1825 Len=80"
"237","6.264015","192.168.100.102","192.168.100.1","TCP","54","64383  >  8888 [ACK] Seq=1 Ack=13741 Win=7632 Len=0"
"238","6.267516","192.168.100.1","192.168.100.102","TCP","134","8888  >  64383 [PSH, ACK] Seq=13741 Ack=1 Win=1825 Len=80"
"239","6.310161","192.168.100.102","192.168.100.1","TCP","54","64383  >  8888 [ACK] Seq=1 Ack=13821 Win=7552 Len=0"
"240","6.391649","192.168.100.1","192.168.100.102","ICMP","98","Echo (ping) request  id=0x794a, seq=0/0, ttl=64 (reply in 241)"
"241","6.391992","192.168.100.102","192.168.100.1","ICMP","98","Echo (ping) reply    id=0x794a, seq=0/0, ttl=128 (request in 240)"
"242","6.456271","192.168.100.1","192.168.100.255","UDP","86","46573  >  8668 Len=44"
"243","6.518004","192.168.100.1","192.168.100.102","TCP","574","8888  >  64383 [PSH, ACK] Seq=13821 Ack=1 Win=1825 Len=520"
"244","6.573032","192.168.100.102","192.168.100.1","TCP","54","64383  >  8888 [ACK] Seq=1 Ack=14341 Win=7032 Len=0"
"245","6.575972","192.168.100.1","192.168.100.102","TCP","174","8888  >  64383 [PSH, ACK] Seq=14341 Ack=1 Win=1825 Len=120"
"246","6.619338","192.168.100.102","192.168.100.1","TCP","54","64383  >  8888 [ACK] Seq=1 Ack=14461 Win=6912 Len=0"
"247","6.622696","192.168.100.1","192.168.100.102","TCP","134","8888  >  64383 [PSH, ACK] Seq=14461 Ack=1 Win=1825 Len=80"
"248","6.666478","192.168.100.102","192.168.100.1","TCP","54","64383  >  8888 [ACK] Seq=1 Ack=14541 Win=6832 Len=0"
"249","6.669496","192.168.100.1","192.168.100.102","TCP","238","8888  >  64383 [PSH, ACK] Seq=14541 Ack=1 Win=1825 Len=184"
"250","6.713654","192.168.100.102","192.168.100.1","TCP","54","64383  >  8888 [ACK] Seq=1 Ack=14725 Win=6648 Len=0"
"251","6.716729","192.168.100.1","192.168.100.102","TCP","174","8888  >  64383 [PSH, ACK] Seq=14725 Ack=1 Win=1825 Len=120"
"252","6.759771","192.168.100.102","192.168.100.1","TCP","54","64383  >  8888 [ACK] Seq=1 Ack=14845 Win=6528 Len=0"
"253","6.763473","192.168.100.1","192.168.100.102","TCP","134","8888  >  64383 [PSH, ACK] Seq=14845 Ack=1 Win=1825 Len=80"
"254","6.805605","192.168.100.102","192.168.100.1","TCP","54","64383  >  8888 [ACK] Seq=1 Ack=14925 Win=6448 Len=0"
"255","6.808463","192.168.100.1","192.168.100.102","TCP","134","8888  >  64383 [PSH, ACK] Seq=14925 Ack=1 Win=1825 Len=80"
"256","6.851410","192.168.100.102","192.168.100.1","TCP","54","64383  >  8888 [ACK] Seq=1 Ack=15005 Win=6368 Len=0"
"257","6.854218","192.168.100.1","192.168.100.102","TCP","240","8888  >  64383 [PSH, ACK] Seq=15005 Ack=1 Win=1825 Len=186"
"258","6.898505","192.168.100.102","192.168.100.1","TCP","54","64383  >  8888 [ACK] Seq=1 Ack=15191 Win=6182 Len=0"
"259","6.912138","192.168.100.1","192.168.100.102","TCP","174","8888  >  64383 [PSH, ACK] Seq=15191 Ack=1 Win=1825 Len=120"
"260","6.960250","192.168.100.102","192.168.100.1","TCP","54","64383  >  8888 [ACK] Seq=1 Ack=15311 Win=6062 Len=0"
"261","6.963241","192.168.100.1","192.168.100.102","TCP","174","8888  >  64383 [PSH, ACK] Seq=15311 Ack=1 Win=1825 Len=120"
"262","7.006637","192.168.100.102","192.168.100.1","TCP","54","64383  >  8888 [ACK] Seq=1 Ack=15431 Win=5942 Len=0"
"263","7.009712","192.168.100.1","192.168.100.102","TCP","134","8888  >  64383 [PSH, ACK] Seq=15431 Ack=1 Win=1825 Len=80"
"264","7.053096","192.168.100.102","192.168.100.1","TCP","54","64383  >  8888 [ACK] Seq=1 Ack=15511 Win=5862 Len=0"
"265","7.055933","192.168.100.1","192.168.100.102","TCP","134","8888  >  64383 [PSH, ACK] Seq=15511 Ack=1 Win=1825 Len=80"
"266","7.098950","192.168.100.102","192.168.100.1","TCP","54","64383  >  8888 [ACK] Seq=1 Ack=15591 Win=5782 Len=0"
"267","7.101900","192.168.100.1","192.168.100.102","TCP","174","8888  >  64383 [PSH, ACK] Seq=15591 Ack=1 Win=1825 Len=120"
"268","7.144711","192.168.100.102","192.168.100.1","TCP","54","64383  >  8888 [ACK] Seq=1 Ack=15711 Win=5662 Len=0"
"269","7.152373","192.168.100.1","192.168.100.102","TCP","134","8888  >  64383 [PSH, ACK] Seq=15711 Ack=1 Win=1825 Len=80"
"270","7.207290","192.168.100.102","192.168.100.1","TCP","54","64383  >  8888 [ACK] Seq=1 Ack=15791 Win=5582 Len=0"
"271","7.212935","192.168.100.1","192.168.100.102","TCP","174","8888  >  64383 [PSH, ACK] Seq=15791 Ack=1 Win=1825 Len=120"
"272","7.253222","192.168.100.102","192.168.100.1","TCP","54","64383  >  8888 [ACK] Seq=1 Ack=15911 Win=5462 Len=0"
"273","7.258731","192.168.100.1","192.168.100.102","TCP","174","8888  >  64383 [PSH, ACK] Seq=15911 Ack=1 Win=1825 Len=120"
"274","7.300152","192.168.100.102","192.168.100.1","TCP","54","64383  >  8888 [ACK] Seq=1 Ack=16031 Win=5342 Len=0"
"275","7.303202","192.168.100.1","192.168.100.102","TCP","134","8888  >  64383 [PSH, ACK] Seq=16031 Ack=1 Win=1825 Len=80"
"276","7.346179","192.168.100.102","192.168.100.1","TCP","54","64383  >  8888 [ACK] Seq=1 Ack=16111 Win=5262 Len=0"
"277","7.351092","192.168.100.1","192.168.100.102","TCP","134","8888  >  64383 [PSH, ACK] Seq=16111 Ack=1 Win=1825 Len=80"
"278","7.393493","192.168.100.102","192.168.100.1","TCP","54","64383  >  8888 [ACK] Seq=1 Ack=16191 Win=5182 Len=0"
"279","7.396116","192.168.100.1","192.168.100.102","TCP","174","8888  >  64383 [PSH, ACK] Seq=16191 Ack=1 Win=1825 Len=120"
"280","7.440967","192.168.100.102","192.168.100.1","TCP","54","64383  >  8888 [ACK] Seq=1 Ack=16311 Win=5062 Len=0"
"281","7.444529","192.168.100.1","192.168.100.102","TCP","134","8888  >  64383 [PSH, ACK] Seq=16311 Ack=1 Win=1825 Len=80"
"282","7.486942","192.168.100.102","192.168.100.1","TCP","54","64383  >  8888 [ACK] Seq=1 Ack=16391 Win=4982 Len=0"
"283","7.602704","192.168.100.1","192.168.100.102","ICMP","98","Echo (ping) request  id=0x9c4a, seq=0/0, ttl=64 (no response found!)"
