"No.","Time","Source","Destination","Protocol","Length","Info"
"1","0.000000","192.168.100.1","192.168.100.255","UDP","86","46573  >  8668 Len=44"
"2","1.000417","192.168.100.1","192.168.100.255","UDP","86","46573  >  8668 Len=44"
"3","1.136108","192.168.100.102","224.0.0.251","MDNS","204","Standard query response 0x0000 PTR HP-JG._dosvc._tcp.local SRV 0 0 7680 HP-JG.local TXT"
"4","1.137053","fe80::69a5:ccfc:54ae:f895","ff02::fb","MDNS","224","Standard query response 0x0000 PTR HP-JG._dosvc._tcp.local SRV 0 0 7680 HP-JG.local TXT"
"5","1.139470","192.168.100.102","224.0.0.251","MDNS","83","Standard query 0x0000 ANY HP-JG._dosvc._tcp.local, ""QM"" question"
"6","1.140165","fe80::69a5:ccfc:54ae:f895","ff02::fb","MDNS","103","Standard query 0x0000 ANY HP-JG._dosvc._tcp.local, ""QM"" question"
"7","1.396213","192.168.100.102","224.0.0.251","MDNS","83","Standard query 0x0000 ANY HP-JG._dosvc._tcp.local, ""QM"" question"
"8","1.397105","fe80::69a5:ccfc:54ae:f895","ff02::fb","MDNS","103","Standard query 0x0000 ANY HP-JG._dosvc._tcp.local, ""QM"" question"
"9","1.661204","192.168.100.102","224.0.0.251","MDNS","83","Standard query 0x0000 ANY HP-JG._dosvc._tcp.local, ""QM"" question"
"10","1.662136","fe80::69a5:ccfc:54ae:f895","ff02::fb","MDNS","103","Standard query 0x0000 ANY HP-JG._dosvc._tcp.local, ""QM"" question"
"11","1.930670","192.168.100.102","224.0.0.251","MDNS","259","Standard query response 0x0000 PTR, cache flush HP-JG._dosvc._tcp.local SRV, cache flush 0 0 7680 HP-JG.local TXT, cache flush A, cache flush 192.168.100.102 AAAA, cache flush fe80::69a5:ccfc:54ae:f895"
"12","1.932876","192.168.100.102","224.0.0.251","MDNS","205","Standard query response 0x0000 SRV, cache flush 0 0 7680 HP-JG.local TXT, cache flush A, cache flush 192.168.100.102 AAAA, cache flush fe80::69a5:ccfc:54ae:f895"
"13","2.000701","192.168.100.1","192.168.100.255","UDP","86","46573  >  8668 Len=44"
"14","2.790473","192.168.100.102","192.168.100.1","DNS","98","Standard query 0xadd8 A telemetry.individual.githubcopilot.com"
"15","2.843455","192.168.100.1","192.168.100.102","DNS","98","Standard query response 0xadd8 Refused A telemetry.individual.githubcopilot.com"
"16","3.001174","192.168.100.1","192.168.100.255","UDP","86","46573  >  8668 Len=44"
"17","5.001252","192.168.100.1","192.168.100.255","UDP","86","46573  >  8668 Len=44"
"18","6.002216","192.168.100.1","192.168.100.255","UDP","86","46573  >  8668 Len=44"
"19","7.003241","192.168.100.1","192.168.100.255","UDP","86","46573  >  8668 Len=44"
"20","8.002251","192.168.100.1","192.168.100.255","UDP","86","46573  >  8668 Len=44"
"21","8.006658","192.168.100.102","192.168.100.1","TCP","66","65382  >  8888 [SYN] Seq=0 Win=65535 Len=0 MSS=1460 WS=256 SACK_PERM"
"22","8.009453","192.168.100.1","192.168.100.102","TCP","66","8888  >  65382 [SYN, ACK] Seq=0 Ack=1 Win=14600 Len=0 MSS=1460 SACK_PERM WS=8"
"23","8.009522","192.168.100.102","192.168.100.1","TCP","54","65382  >  8888 [ACK] Seq=1 Ack=1 Win=65280 Len=0"
"24","8.078578","192.168.100.1","192.168.100.102","TCP","94","8888  >  65382 [PSH, ACK] Seq=1 Ack=1 Win=14600 Len=40"
"25","8.133121","192.168.100.102","192.168.100.1","TCP","54","65382  >  8888 [ACK] Seq=1 Ack=41 Win=65280 Len=0"
"26","8.137100","192.168.100.1","192.168.100.102","TCP","214","8888  >  65382 [PSH, ACK] Seq=41 Ack=1 Win=14600 Len=160"
"27","8.179998","192.168.100.102","192.168.100.1","TCP","54","65382  >  8888 [ACK] Seq=1 Ack=201 Win=65280 Len=0"
"28","8.183002","192.168.100.1","192.168.100.102","TCP","280","8888  >  65382 [PSH, ACK] Seq=201 Ack=1 Win=14600 Len=226"
"29","8.190312","192.168.100.102","192.168.100.1","TCP","135","65382  >  8888 [PSH, ACK] Seq=1 Ack=427 Win=65024 Len=81"
"30","8.193210","192.168.100.1","192.168.100.102","TCP","54","8888  >  65382 [ACK] Seq=427 Ack=82 Win=14600 Len=0"
"31","8.201824","192.168.100.1","192.168.100.102","TCP","94","8888  >  65382 [PSH, ACK] Seq=427 Ack=82 Win=14600 Len=40"
"32","8.241825","192.168.100.102","192.168.100.1","TCP","54","65382  >  8888 [ACK] Seq=82 Ack=467 Win=65024 Len=0"
"33","8.244536","192.168.100.1","192.168.100.102","TCP","134","8888  >  65382 [PSH, ACK] Seq=467 Ack=82 Win=14600 Len=80"
"34","8.287996","192.168.100.102","192.168.100.1","TCP","54","65382  >  8888 [ACK] Seq=82 Ack=547 Win=64768 Len=0"
"35","8.291138","192.168.100.1","192.168.100.102","TCP","215","8888  >  65382 [PSH, ACK] Seq=547 Ack=82 Win=14600 Len=161"
"36","8.291960","192.168.100.102","192.168.100.1","TCP","82","65382  >  8888 [PSH, ACK] Seq=82 Ack=708 Win=64768 Len=28"
"37","8.304601","192.168.100.1","192.168.100.102","TCP","94","8888  >  65382 [PSH, ACK] Seq=708 Ack=110 Win=14600 Len=40"
"38","8.349113","192.168.100.102","192.168.100.1","TCP","54","65382  >  8888 [ACK] Seq=110 Ack=748 Win=64768 Len=0"
"39","8.352255","192.168.100.1","192.168.100.102","TCP","134","8888  >  65382 [PSH, ACK] Seq=748 Ack=110 Win=14600 Len=80"
"40","8.392451","192.168.100.102","192.168.100.1","TCP","82","65382  >  8888 [PSH, ACK] Seq=110 Ack=828 Win=64512 Len=28"
"41","8.395539","192.168.100.1","192.168.100.102","TCP","148","8888  >  65382 [PSH, ACK] Seq=828 Ack=138 Win=14600 Len=94"
"42","8.440946","192.168.100.102","192.168.100.1","TCP","54","65382  >  8888 [ACK] Seq=138 Ack=922 Win=64512 Len=0"
"43","8.445103","192.168.100.1","192.168.100.102","TCP","174","8888  >  65382 [PSH, ACK] Seq=922 Ack=138 Win=14600 Len=120"
"44","8.488121","192.168.100.102","192.168.100.1","TCP","54","65382  >  8888 [ACK] Seq=138 Ack=1042 Win=64256 Len=0"
"45","8.491186","192.168.100.1","192.168.100.102","TCP","148","8888  >  65382 [PSH, ACK] Seq=1042 Ack=138 Win=14600 Len=94"
"46","8.492988","192.168.100.102","192.168.100.1","TCP","82","65382  >  8888 [PSH, ACK] Seq=138 Ack=1136 Win=64256 Len=28"
"47","8.502121","192.168.100.1","192.168.100.102","TCP","94","8888  >  65382 [PSH, ACK] Seq=1136 Ack=166 Win=14600 Len=40"
"48","8.548216","192.168.100.102","192.168.100.1","TCP","54","65382  >  8888 [ACK] Seq=166 Ack=1176 Win=64256 Len=0"
"49","8.551315","192.168.100.1","192.168.100.102","TCP","148","8888  >  65382 [PSH, ACK] Seq=1176 Ack=166 Win=14600 Len=94"
"50","8.593674","192.168.100.102","192.168.100.1","TCP","82","65382  >  8888 [PSH, ACK] Seq=166 Ack=1270 Win=64256 Len=28"
"51","8.596746","192.168.100.1","192.168.100.102","TCP","134","8888  >  65382 [PSH, ACK] Seq=1270 Ack=194 Win=14600 Len=80"
"52","8.640752","192.168.100.102","192.168.100.1","TCP","54","65382  >  8888 [ACK] Seq=194 Ack=1350 Win=64000 Len=0"
"53","8.643574","192.168.100.1","192.168.100.102","TCP","134","8888  >  65382 [PSH, ACK] Seq=1350 Ack=194 Win=14600 Len=80"
"54","8.686706","192.168.100.102","192.168.100.1","TCP","54","65382  >  8888 [ACK] Seq=194 Ack=1430 Win=64000 Len=0"
"55","8.689640","192.168.100.1","192.168.100.102","TCP","174","8888  >  65382 [PSH, ACK] Seq=1430 Ack=194 Win=14600 Len=120"
"56","8.695288","192.168.100.102","192.168.100.1","TCP","78","65382  >  8888 [PSH, ACK] Seq=194 Ack=1550 Win=65280 Len=24"
"57","8.707375","192.168.100.1","192.168.100.102","TCP","94","8888  >  65382 [PSH, ACK] Seq=1550 Ack=218 Win=14600 Len=40"
"58","8.748676","192.168.100.102","192.168.100.1","TCP","54","65382  >  8888 [ACK] Seq=218 Ack=1590 Win=65280 Len=0"
"59","8.752760","192.168.100.1","192.168.100.102","TCP","134","8888  >  65382 [PSH, ACK] Seq=1590 Ack=218 Win=14600 Len=80"
"60","8.795463","192.168.100.102","192.168.100.1","TCP","54","65382  >  8888 [ACK] Seq=218 Ack=1670 Win=65280 Len=0"
"61","8.798168","192.168.100.102","192.168.100.1","TCP","82","65382  >  8888 [PSH, ACK] Seq=218 Ack=1670 Win=65280 Len=28"
"62","8.798370","192.168.100.1","192.168.100.102","TCP","134","8888  >  65382 [PSH, ACK] Seq=1670 Ack=218 Win=14600 Len=80"
"63","8.841181","192.168.100.1","192.168.100.102","TCP","54","8888  >  65382 [ACK] Seq=1750 Ack=246 Win=14600 Len=0"
"64","8.842942","192.168.100.102","192.168.100.1","TCP","54","65382  >  8888 [ACK] Seq=246 Ack=1750 Win=65280 Len=0"
"65","8.845968","192.168.100.1","192.168.100.102","TCP","215","8888  >  65382 [PSH, ACK] Seq=1750 Ack=246 Win=14600 Len=161"
"66","8.888960","192.168.100.102","192.168.100.1","TCP","54","65382  >  8888 [ACK] Seq=246 Ack=1911 Win=65024 Len=0"
"67","8.900517","192.168.100.102","192.168.100.1","TCP","91","65382  >  8888 [PSH, ACK] Seq=246 Ack=1911 Win=65024 Len=37"
"68","9.034162","192.168.100.1","192.168.100.102","ICMP","98","Echo (ping) request  id=0x4d24, seq=0/0, ttl=64 (reply in 69)"
"69","9.034633","192.168.100.102","192.168.100.1","ICMP","98","Echo (ping) reply    id=0x4d24, seq=0/0, ttl=128 (request in 68)"
"70","9.075901","192.168.100.102","192.168.100.1","DNS","83","Standard query 0x863c A www.msftconnecttest.com"
"71","9.076856","192.168.100.102","192.168.100.1","DNS","83","Standard query 0xd8c4 A www.msftconnecttest.com"
"72","9.083094","192.168.100.1","192.168.100.102","TCP","638","8888  >  65382 [PSH, ACK] Seq=1911 Ack=246 Win=14600 Len=584"
"73","9.087765","192.168.100.1","192.168.100.102","DNS","83","Standard query response 0x863c Refused A www.msftconnecttest.com"
"74","9.087765","192.168.100.1","192.168.100.102","DNS","83","Standard query response 0xd8c4 Refused A www.msftconnecttest.com"
"75","9.094302","192.168.100.1","192.168.100.255","UDP","86","46573  >  8668 Len=44"
"76","9.122297","192.168.100.102","192.168.100.1","TCP","91","[TCP Retransmission] 65382  >  8888 [PSH, ACK] Seq=246 Ack=2495 Win=64512 Len=37"
"77","9.125212","192.168.100.1","192.168.100.102","TCP","134","8888  >  65382 [PSH, ACK] Seq=2495 Ack=283 Win=14600 Len=80"
"78","9.137035","192.168.100.102","192.168.100.1","UDP","51","54930  >  8085 Len=9"
"79","9.169722","192.168.100.102","192.168.100.1","TCP","54","65382  >  8888 [ACK] Seq=283 Ack=2575 Win=64256 Len=0"
"80","9.173504","192.168.100.1","192.168.100.102","TCP","255","8888  >  65382 [PSH, ACK] Seq=2575 Ack=283 Win=14600 Len=201"
"81","9.215721","192.168.100.102","192.168.100.1","TCP","54","65382  >  8888 [ACK] Seq=283 Ack=2776 Win=64256 Len=0"
"82","9.218719","192.168.100.1","192.168.100.102","TCP","174","8888  >  65382 [PSH, ACK] Seq=2776 Ack=283 Win=14600 Len=120"
"83","9.262474","192.168.100.102","192.168.100.1","TCP","54","65382  >  8888 [ACK] Seq=283 Ack=2896 Win=64000 Len=0"
"84","9.265371","192.168.100.1","192.168.100.102","TCP","174","8888  >  65382 [PSH, ACK] Seq=2896 Ack=283 Win=14600 Len=120"
"85","9.309054","192.168.100.102","192.168.100.1","TCP","54","65382  >  8888 [ACK] Seq=283 Ack=3016 Win=65280 Len=0"
"86","9.314398","192.168.100.1","192.168.100.102","TCP","134","8888  >  65382 [PSH, ACK] Seq=3016 Ack=283 Win=14600 Len=80"
"87","9.355804","192.168.100.102","192.168.100.1","TCP","54","65382  >  8888 [ACK] Seq=283 Ack=3096 Win=65280 Len=0"
"88","9.358832","192.168.100.1","192.168.100.102","TCP","134","8888  >  65382 [PSH, ACK] Seq=3096 Ack=283 Win=14600 Len=80"
"89","9.402313","192.168.100.102","192.168.100.1","TCP","54","65382  >  8888 [ACK] Seq=283 Ack=3176 Win=65280 Len=0"
"90","9.405354","192.168.100.1","192.168.100.102","TCP","174","8888  >  65382 [PSH, ACK] Seq=3176 Ack=283 Win=14600 Len=120"
"91","9.447562","192.168.100.102","192.168.100.1","TCP","54","65382  >  8888 [ACK] Seq=283 Ack=3296 Win=65024 Len=0"
"92","9.450505","192.168.100.1","192.168.100.102","TCP","134","8888  >  65382 [PSH, ACK] Seq=3296 Ack=283 Win=14600 Len=80"
"93","9.494518","192.168.100.102","192.168.100.1","TCP","54","65382  >  8888 [ACK] Seq=283 Ack=3376 Win=65024 Len=0"
"94","9.497240","192.168.100.1","192.168.100.102","TCP","134","8888  >  65382 [PSH, ACK] Seq=3376 Ack=283 Win=14600 Len=80"
"95","9.541276","192.168.100.102","192.168.100.1","TCP","54","65382  >  8888 [ACK] Seq=283 Ack=3456 Win=65024 Len=0"
"96","9.544352","192.168.100.1","192.168.100.102","TCP","134","8888  >  65382 [PSH, ACK] Seq=3456 Ack=283 Win=14600 Len=80"
"97","9.587748","192.168.100.102","192.168.100.1","TCP","54","65382  >  8888 [ACK] Seq=283 Ack=3536 Win=64768 Len=0"
"98","9.592095","192.168.100.1","192.168.100.102","TCP","174","8888  >  65382 [PSH, ACK] Seq=3536 Ack=283 Win=14600 Len=120"
"99","9.634172","192.168.100.102","192.168.100.1","TCP","54","65382  >  8888 [ACK] Seq=283 Ack=3656 Win=64768 Len=0"
"100","9.637060","192.168.100.1","192.168.100.102","TCP","134","8888  >  65382 [PSH, ACK] Seq=3656 Ack=283 Win=14600 Len=80"
"101","9.681021","192.168.100.102","192.168.100.1","TCP","54","65382  >  8888 [ACK] Seq=283 Ack=3736 Win=64768 Len=0"
"102","9.683675","192.168.100.1","192.168.100.102","TCP","134","8888  >  65382 [PSH, ACK] Seq=3736 Ack=283 Win=14600 Len=80"
"103","9.728291","192.168.100.102","192.168.100.1","TCP","54","65382  >  8888 [ACK] Seq=283 Ack=3816 Win=64512 Len=0"
"104","9.731303","192.168.100.1","192.168.100.102","TCP","134","8888  >  65382 [PSH, ACK] Seq=3816 Ack=283 Win=14600 Len=80"
"105","9.775278","192.168.100.102","192.168.100.1","TCP","54","65382  >  8888 [ACK] Seq=283 Ack=3896 Win=64512 Len=0"
"106","9.778154","192.168.100.1","192.168.100.102","TCP","174","8888  >  65382 [PSH, ACK] Seq=3896 Ack=283 Win=14600 Len=120"
"107","9.821819","192.168.100.102","192.168.100.1","TCP","54","65382  >  8888 [ACK] Seq=283 Ack=4016 Win=64512 Len=0"
"108","9.826207","192.168.100.1","192.168.100.102","TCP","134","8888  >  65382 [PSH, ACK] Seq=4016 Ack=283 Win=14600 Len=80"
"109","9.868737","192.168.100.102","192.168.100.1","TCP","54","65382  >  8888 [ACK] Seq=283 Ack=4096 Win=64256 Len=0"
"110","9.871525","192.168.100.1","192.168.100.102","TCP","134","8888  >  65382 [PSH, ACK] Seq=4096 Ack=283 Win=14600 Len=80"
"111","9.915752","192.168.100.102","192.168.100.1","TCP","54","65382  >  8888 [ACK] Seq=283 Ack=4176 Win=64256 Len=0"
"112","9.918787","192.168.100.1","192.168.100.102","TCP","174","8888  >  65382 [PSH, ACK] Seq=4176 Ack=283 Win=14600 Len=120"
"113","9.960573","192.168.100.102","192.168.100.1","TCP","54","65382  >  8888 [ACK] Seq=283 Ack=4296 Win=64000 Len=0"
"114","9.963543","192.168.100.1","192.168.100.102","TCP","134","8888  >  65382 [PSH, ACK] Seq=4296 Ack=283 Win=14600 Len=80"
"115","10.006812","192.168.100.102","192.168.100.1","TCP","54","65382  >  8888 [ACK] Seq=283 Ack=4376 Win=64000 Len=0"
"116","10.009943","192.168.100.1","192.168.100.102","TCP","174","8888  >  65382 [PSH, ACK] Seq=4376 Ack=283 Win=14600 Len=120"
"117","10.054115","192.168.100.102","192.168.100.1","TCP","54","65382  >  8888 [ACK] Seq=283 Ack=4496 Win=65280 Len=0"
"118","10.057363","192.168.100.1","192.168.100.102","TCP","134","8888  >  65382 [PSH, ACK] Seq=4496 Ack=283 Win=14600 Len=80"
"119","10.101301","192.168.100.102","192.168.100.1","TCP","54","65382  >  8888 [ACK] Seq=283 Ack=4576 Win=65280 Len=0"
"120","10.103993","192.168.100.102","192.168.100.1","DNS","94","Standard query 0x0010 A p2p-hkg1.discovery.steamserver.net"
"121","10.135178","192.168.100.102","192.168.100.1","UDP","51","54930  >  8085 Len=9"
"122","10.203403","192.168.100.1","192.168.100.102","ICMP","98","Echo (ping) request  id=0x6924, seq=0/0, ttl=64 (reply in 123)"
"123","10.203801","192.168.100.102","192.168.100.1","ICMP","98","Echo (ping) reply    id=0x6924, seq=0/0, ttl=128 (request in 122)"
"124","10.267571","192.168.100.1","192.168.100.255","UDP","86","46573  >  8668 Len=44"
"125","10.308252","192.168.100.1","192.168.100.102","TCP","744","8888  >  65382 [PSH, ACK] Seq=4576 Ack=283 Win=14600 Len=690"
"126","10.351637","192.168.100.102","192.168.100.1","TCP","54","65382  >  8888 [ACK] Seq=283 Ack=5266 Win=64512 Len=0"
"127","10.354993","192.168.100.1","192.168.100.102","TCP","174","8888  >  65382 [PSH, ACK] Seq=5266 Ack=283 Win=14600 Len=120"
"128","10.396806","192.168.100.102","192.168.100.1","TCP","54","65382  >  8888 [ACK] Seq=283 Ack=5386 Win=64512 Len=0"
"129","10.399875","192.168.100.1","192.168.100.102","TCP","134","8888  >  65382 [PSH, ACK] Seq=5386 Ack=283 Win=14600 Len=80"
"130","10.443010","192.168.100.102","192.168.100.1","TCP","54","65382  >  8888 [ACK] Seq=283 Ack=5466 Win=64512 Len=0"
"131","10.445846","192.168.100.1","192.168.100.102","TCP","134","8888  >  65382 [PSH, ACK] Seq=5466 Ack=283 Win=14600 Len=80"
"132","10.489330","192.168.100.102","192.168.100.1","TCP","54","65382  >  8888 [ACK] Seq=283 Ack=5546 Win=64256 Len=0"
"133","10.493423","192.168.100.1","192.168.100.102","TCP","174","8888  >  65382 [PSH, ACK] Seq=5546 Ack=283 Win=14600 Len=120"
"134","10.515714","192.168.100.102","192.168.100.1","DNS","92","Standard query 0x9cce A api.individual.githubcopilot.com"
"135","10.518930","192.168.100.1","192.168.100.102","DNS","92","Standard query response 0x9cce Refused A api.individual.githubcopilot.com"
"136","10.535992","192.168.100.102","192.168.100.1","TCP","54","65382  >  8888 [ACK] Seq=283 Ack=5666 Win=64256 Len=0"
"137","10.538926","192.168.100.1","192.168.100.102","TCP","134","8888  >  65382 [PSH, ACK] Seq=5666 Ack=283 Win=14600 Len=80"
"138","10.581492","192.168.100.102","192.168.100.1","TCP","54","65382  >  8888 [ACK] Seq=283 Ack=5746 Win=64256 Len=0"
"139","10.584205","192.168.100.1","192.168.100.102","TCP","134","8888  >  65382 [PSH, ACK] Seq=5746 Ack=283 Win=14600 Len=80"
"140","10.627618","192.168.100.102","192.168.100.1","TCP","54","65382  >  8888 [ACK] Seq=283 Ack=5826 Win=64000 Len=0"
"141","10.631254","192.168.100.1","192.168.100.102","TCP","174","8888  >  65382 [PSH, ACK] Seq=5826 Ack=283 Win=14600 Len=120"
"142","10.674584","192.168.100.102","192.168.100.1","TCP","54","65382  >  8888 [ACK] Seq=283 Ack=5946 Win=64000 Len=0"
"143","10.677620","192.168.100.1","192.168.100.102","TCP","134","8888  >  65382 [PSH, ACK] Seq=5946 Ack=283 Win=14600 Len=80"
"144","10.720439","192.168.100.102","192.168.100.1","TCP","54","65382  >  8888 [ACK] Seq=283 Ack=6026 Win=65280 Len=0"
"145","10.723156","192.168.100.1","192.168.100.102","TCP","134","8888  >  65382 [PSH, ACK] Seq=6026 Ack=283 Win=14600 Len=80"
"146","10.767455","192.168.100.102","192.168.100.1","TCP","54","65382  >  8888 [ACK] Seq=283 Ack=6106 Win=65280 Len=0"
"147","10.772965","192.168.100.1","192.168.100.102","TCP","134","8888  >  65382 [PSH, ACK] Seq=6106 Ack=283 Win=14600 Len=80"
"148","10.814409","192.168.100.102","192.168.100.1","TCP","54","65382  >  8888 [ACK] Seq=283 Ack=6186 Win=65280 Len=0"
"149","10.817323","192.168.100.1","192.168.100.102","TCP","134","8888  >  65382 [PSH, ACK] Seq=6186 Ack=283 Win=14600 Len=80"
"150","10.861043","192.168.100.102","192.168.100.1","TCP","54","65382  >  8888 [ACK] Seq=283 Ack=6266 Win=65280 Len=0"
"151","10.880246","192.168.100.1","192.168.100.102","TCP","174","8888  >  65382 [PSH, ACK] Seq=6266 Ack=283 Win=14600 Len=120"
"152","10.922862","192.168.100.102","192.168.100.1","TCP","54","65382  >  8888 [ACK] Seq=283 Ack=6386 Win=65024 Len=0"
"153","10.930128","192.168.100.1","192.168.100.102","TCP","174","8888  >  65382 [PSH, ACK] Seq=6386 Ack=283 Win=14600 Len=120"
"154","10.984260","192.168.100.102","192.168.100.1","TCP","54","65382  >  8888 [ACK] Seq=283 Ack=6506 Win=65024 Len=0"
"155","10.987053","192.168.100.1","192.168.100.102","TCP","174","8888  >  65382 [PSH, ACK] Seq=6506 Ack=283 Win=14600 Len=120"
"156","11.032214","192.168.100.102","192.168.100.1","TCP","54","65382  >  8888 [ACK] Seq=283 Ack=6626 Win=64768 Len=0"
"157","11.035003","192.168.100.1","192.168.100.102","TCP","174","8888  >  65382 [PSH, ACK] Seq=6626 Ack=283 Win=14600 Len=120"
"158","11.078185","192.168.100.102","192.168.100.1","TCP","54","65382  >  8888 [ACK] Seq=283 Ack=6746 Win=64768 Len=0"
"159","11.081025","192.168.100.1","192.168.100.102","TCP","238","8888  >  65382 [PSH, ACK] Seq=6746 Ack=283 Win=14600 Len=184"
"160","11.124904","192.168.100.102","192.168.100.1","TCP","54","65382  >  8888 [ACK] Seq=283 Ack=6930 Win=64512 Len=0"
"161","11.126261","192.168.100.102","192.168.100.1","UDP","51","54930  >  8085 Len=9"
"162","11.127739","192.168.100.1","192.168.100.102","TCP","134","8888  >  65382 [PSH, ACK] Seq=6930 Ack=283 Win=14600 Len=80"
"163","11.170510","192.168.100.102","192.168.100.1","TCP","54","65382  >  8888 [ACK] Seq=283 Ack=7010 Win=64512 Len=0"
"164","11.173536","192.168.100.1","192.168.100.102","TCP","240","8888  >  65382 [PSH, ACK] Seq=7010 Ack=283 Win=14600 Len=186"
"165","11.216984","192.168.100.102","192.168.100.1","TCP","54","65382  >  8888 [ACK] Seq=283 Ack=7196 Win=64256 Len=0"
"166","11.220323","192.168.100.1","192.168.100.102","TCP","174","8888  >  65382 [PSH, ACK] Seq=7196 Ack=283 Win=14600 Len=120"
"167","11.262719","192.168.100.102","192.168.100.1","TCP","54","65382  >  8888 [ACK] Seq=283 Ack=7316 Win=64000 Len=0"
"168","11.265727","192.168.100.1","192.168.100.102","TCP","134","8888  >  65382 [PSH, ACK] Seq=7316 Ack=283 Win=14600 Len=80"
"169","11.308745","192.168.100.102","192.168.100.1","TCP","54","65382  >  8888 [ACK] Seq=283 Ack=7396 Win=64000 Len=0"
"170","11.312731","192.168.100.1","192.168.100.102","TCP","134","8888  >  65382 [PSH, ACK] Seq=7396 Ack=283 Win=14600 Len=80"
"171","11.355469","192.168.100.102","192.168.100.1","TCP","54","65382  >  8888 [ACK] Seq=283 Ack=7476 Win=64000 Len=0"
"172","11.437922","192.168.100.1","192.168.100.102","ICMP","98","Echo (ping) request  id=0x8924, seq=0/0, ttl=64 (reply in 173)"
"173","11.438242","192.168.100.102","192.168.100.1","ICMP","98","Echo (ping) reply    id=0x8924, seq=0/0, ttl=128 (request in 172)"
"174","11.506683","192.168.100.1","192.168.100.255","UDP","86","46573  >  8668 Len=44"
"175","11.565284","192.168.100.1","192.168.100.102","TCP","574","8888  >  65382 [PSH, ACK] Seq=7476 Ack=283 Win=14600 Len=520"
"176","11.619924","192.168.100.102","192.168.100.1","TCP","54","65382  >  8888 [ACK] Seq=283 Ack=7996 Win=65280 Len=0"
"177","11.622494","192.168.100.1","192.168.100.102","TCP","174","8888  >  65382 [PSH, ACK] Seq=7996 Ack=283 Win=14600 Len=120"
"178","11.666333","192.168.100.102","192.168.100.1","TCP","54","65382  >  8888 [ACK] Seq=283 Ack=8116 Win=65280 Len=0"
"179","11.669416","192.168.100.1","192.168.100.102","TCP","134","8888  >  65382 [PSH, ACK] Seq=8116 Ack=283 Win=14600 Len=80"
"180","11.711908","192.168.100.102","192.168.100.1","TCP","54","65382  >  8888 [ACK] Seq=283 Ack=8196 Win=65280 Len=0"
"181","11.714712","192.168.100.1","192.168.100.102","TCP","134","8888  >  65382 [PSH, ACK] Seq=8196 Ack=283 Win=14600 Len=80"
"182","11.757899","192.168.100.102","192.168.100.1","TCP","54","65382  >  8888 [ACK] Seq=283 Ack=8276 Win=65024 Len=0"
"183","11.761123","192.168.100.1","192.168.100.102","TCP","134","8888  >  65382 [PSH, ACK] Seq=8276 Ack=283 Win=14600 Len=80"
"184","11.803609","192.168.100.102","192.168.100.1","TCP","54","65382  >  8888 [ACK] Seq=283 Ack=8356 Win=65024 Len=0"
"185","11.806912","192.168.100.1","192.168.100.102","TCP","174","8888  >  65382 [PSH, ACK] Seq=8356 Ack=283 Win=14600 Len=120"
"186","11.851464","192.168.100.102","192.168.100.1","TCP","54","65382  >  8888 [ACK] Seq=283 Ack=8476 Win=65024 Len=0"
"187","11.854417","192.168.100.1","192.168.100.102","TCP","134","8888  >  65382 [PSH, ACK] Seq=8476 Ack=283 Win=14600 Len=80"
"188","11.899255","192.168.100.102","192.168.100.1","TCP","54","65382  >  8888 [ACK] Seq=283 Ack=8556 Win=64768 Len=0"
"189","11.902258","192.168.100.1","192.168.100.102","TCP","134","8888  >  65382 [PSH, ACK] Seq=8556 Ack=283 Win=14600 Len=80"
"190","11.945686","192.168.100.102","192.168.100.1","TCP","54","65382  >  8888 [ACK] Seq=283 Ack=8636 Win=64768 Len=0"
"191","11.949143","192.168.100.1","192.168.100.102","TCP","174","8888  >  65382 [PSH, ACK] Seq=8636 Ack=283 Win=14600 Len=120"
"192","11.955523","192.168.100.102","224.0.0.251","MDNS","80","Standard query 0x0000 A NAS-JG-Schreib.local, ""QM"" question"
"193","11.956306","fe80::69a5:ccfc:54ae:f895","ff02::fb","MDNS","100","Standard query 0x0000 A NAS-JG-Schreib.local, ""QM"" question"
"194","11.956972","192.168.100.102","224.0.0.251","MDNS","80","Standard query 0x0000 A NAS-JG-Schreib.local, ""QM"" question"
"195","11.957501","fe80::69a5:ccfc:54ae:f895","ff02::fb","MDNS","100","Standard query 0x0000 A NAS-JG-Schreib.local, ""QM"" question"
"196","11.958170","192.168.100.102","224.0.0.251","MDNS","80","Standard query 0x0000 AAAA NAS-JG-Schreib.local, ""QU"" question"
"197","11.958620","fe80::69a5:ccfc:54ae:f895","ff02::fb","MDNS","100","Standard query 0x0000 AAAA NAS-JG-Schreib.local, ""QU"" question"
"198","11.959278","192.168.100.102","224.0.0.251","MDNS","80","Standard query 0x0000 AAAA NAS-JG-Schreib.local, ""QU"" question"
"199","11.959818","fe80::69a5:ccfc:54ae:f895","ff02::fb","MDNS","100","Standard query 0x0000 AAAA NAS-JG-Schreib.local, ""QU"" question"
"200","11.964613","192.168.100.102","224.0.0.251","MDNS","80","Standard query 0x0000 A NAS-JG-Schreib.local, ""QM"" question"
"201","11.965330","fe80::69a5:ccfc:54ae:f895","ff02::fb","MDNS","100","Standard query 0x0000 A NAS-JG-Schreib.local, ""QM"" question"
"202","11.965992","192.168.100.102","224.0.0.251","MDNS","80","Standard query 0x0000 AAAA NAS-JG-Schreib.local, ""QU"" question"
"203","11.966570","fe80::69a5:ccfc:54ae:f895","ff02::fb","MDNS","100","Standard query 0x0000 AAAA NAS-JG-Schreib.local, ""QU"" question"
"204","11.992416","192.168.100.102","192.168.100.1","TCP","54","65382  >  8888 [ACK] Seq=283 Ack=8756 Win=64768 Len=0"
"205","11.996247","192.168.100.1","192.168.100.102","TCP","134","8888  >  65382 [PSH, ACK] Seq=8756 Ack=283 Win=14600 Len=80"
"206","12.039376","192.168.100.102","192.168.100.1","TCP","54","65382  >  8888 [ACK] Seq=283 Ack=8836 Win=64512 Len=0"
"207","12.044706","192.168.100.1","192.168.100.102","TCP","174","8888  >  65382 [PSH, ACK] Seq=8836 Ack=283 Win=14600 Len=120"
"208","12.085513","192.168.100.102","192.168.100.1","TCP","54","65382  >  8888 [ACK] Seq=283 Ack=8956 Win=64512 Len=0"
"209","12.091536","192.168.100.1","192.168.100.102","TCP","134","8888  >  65382 [PSH, ACK] Seq=8956 Ack=283 Win=14600 Len=80"
"210","12.125605","192.168.100.102","192.168.100.1","UDP","51","54930  >  8085 Len=9"
"211","12.132519","192.168.100.102","192.168.100.1","TCP","54","65382  >  8888 [ACK] Seq=283 Ack=9036 Win=64256 Len=0"
"212","12.136390","192.168.100.1","192.168.100.102","TCP","238","8888  >  65382 [PSH, ACK] Seq=9036 Ack=283 Win=14600 Len=184"
"213","12.178514","192.168.100.102","192.168.100.1","TCP","54","65382  >  8888 [ACK] Seq=283 Ack=9220 Win=64256 Len=0"
"214","12.181320","192.168.100.1","192.168.100.102","TCP","280","8888  >  65382 [PSH, ACK] Seq=9220 Ack=283 Win=14600 Len=226"
"215","12.224844","192.168.100.102","192.168.100.1","TCP","54","65382  >  8888 [ACK] Seq=283 Ack=9446 Win=64000 Len=0"
"216","12.227616","192.168.100.1","192.168.100.102","TCP","134","8888  >  65382 [PSH, ACK] Seq=9446 Ack=283 Win=14600 Len=80"
"217","12.271871","192.168.100.102","192.168.100.1","TCP","54","65382  >  8888 [ACK] Seq=283 Ack=9526 Win=65280 Len=0"
"218","12.275252","192.168.100.1","192.168.100.102","TCP","134","8888  >  65382 [PSH, ACK] Seq=9526 Ack=283 Win=14600 Len=80"
"219","12.318072","192.168.100.102","192.168.100.1","TCP","54","65382  >  8888 [ACK] Seq=283 Ack=9606 Win=65280 Len=0"
"220","12.320780","192.168.100.1","192.168.100.102","TCP","174","8888  >  65382 [PSH, ACK] Seq=9606 Ack=283 Win=14600 Len=120"
"221","12.364062","192.168.100.102","192.168.100.1","TCP","54","65382  >  8888 [ACK] Seq=283 Ack=9726 Win=65280 Len=0"
"222","12.367200","192.168.100.1","192.168.100.102","TCP","134","8888  >  65382 [PSH, ACK] Seq=9726 Ack=283 Win=14600 Len=80"
"223","12.380290","192.168.100.102","192.168.100.255","NBNS","92","Name query NB NAS-JG-SCHREIB<20>"
"224","12.380544","192.168.100.102","224.0.0.251","MDNS","80","Standard query 0x0000 A NAS-JG-Schreib.local, ""QM"" question"
"225","12.381022","fe80::69a5:ccfc:54ae:f895","ff02::1:3","LLMNR","94","Standard query 0x6621 A NAS-JG-Schreib"
"226","12.381140","192.168.100.102","224.0.0.252","LLMNR","74","Standard query 0x6621 A NAS-JG-Schreib"
"227","12.381548","fe80::69a5:ccfc:54ae:f895","ff02::1:3","LLMNR","94","Standard query 0xa82a AAAA NAS-JG-Schreib"
"228","12.381655","192.168.100.102","224.0.0.252","LLMNR","74","Standard query 0xa82a AAAA NAS-JG-Schreib"
"229","12.382286","fe80::69a5:ccfc:54ae:f895","ff02::fb","MDNS","100","Standard query 0x0000 A NAS-JG-Schreib.local, ""QM"" question"
"230","12.383491","192.168.100.102","224.0.0.251","MDNS","80","Standard query 0x0000 AAAA NAS-JG-Schreib.local, ""QM"" question"
"231","12.385071","fe80::69a5:ccfc:54ae:f895","ff02::fb","MDNS","100","Standard query 0x0000 AAAA NAS-JG-Schreib.local, ""QM"" question"
"232","12.386291","192.168.100.102","224.0.0.251","MDNS","80","Standard query 0x0000 A NAS-JG-Schreib.local, ""QM"" question"
"233","12.387726","fe80::69a5:ccfc:54ae:f895","ff02::fb","MDNS","100","Standard query 0x0000 A NAS-JG-Schreib.local, ""QM"" question"
"234","12.389001","192.168.100.102","224.0.0.251","MDNS","80","Standard query 0x0000 A NAS-JG-Schreib.local, ""QM"" question"
"235","12.390475","fe80::69a5:ccfc:54ae:f895","ff02::fb","MDNS","100","Standard query 0x0000 A NAS-JG-Schreib.local, ""QM"" question"
"236","12.391536","192.168.100.102","224.0.0.251","MDNS","80","Standard query 0x0000 AAAA NAS-JG-Schreib.local, ""QM"" question"
"237","12.392999","fe80::69a5:ccfc:54ae:f895","ff02::fb","MDNS","100","Standard query 0x0000 AAAA NAS-JG-Schreib.local, ""QM"" question"
"238","12.393984","192.168.100.102","224.0.0.251","MDNS","80","Standard query 0x0000 AAAA NAS-JG-Schreib.local, ""QM"" question"
"239","12.395347","fe80::69a5:ccfc:54ae:f895","ff02::fb","MDNS","100","Standard query 0x0000 AAAA NAS-JG-Schreib.local, ""QM"" question"
"240","12.411305","192.168.100.102","192.168.100.1","TCP","54","65382  >  8888 [ACK] Seq=283 Ack=9806 Win=65024 Len=0"
"241","12.414131","192.168.100.1","192.168.100.102","TCP","134","8888  >  65382 [PSH, ACK] Seq=9806 Ack=283 Win=14600 Len=80"
"242","12.456869","192.168.100.102","192.168.100.1","TCP","54","65382  >  8888 [ACK] Seq=283 Ack=9886 Win=65024 Len=0"
"243","12.460613","192.168.100.1","192.168.100.102","TCP","134","8888  >  65382 [PSH, ACK] Seq=9886 Ack=283 Win=14600 Len=80"
"244","12.503948","192.168.100.102","192.168.100.1","TCP","54","65382  >  8888 [ACK] Seq=283 Ack=9966 Win=65024 Len=0"
"245","12.507304","192.168.100.1","192.168.100.102","TCP","174","8888  >  65382 [PSH, ACK] Seq=9966 Ack=283 Win=14600 Len=120"
"246","12.550007","192.168.100.102","192.168.100.1","TCP","54","65382  >  8888 [ACK] Seq=283 Ack=10086 Win=64768 Len=0"
"247","12.640064","192.168.100.1","192.168.100.102","ICMP","98","Echo (ping) request  id=0xa924, seq=0/0, ttl=64 (reply in 248)"
"248","12.640380","192.168.100.102","192.168.100.1","ICMP","98","Echo (ping) reply    id=0xa924, seq=0/0, ttl=128 (request in 247)"
"249","12.695725","192.168.100.1","192.168.100.255","UDP","86","46573  >  8668 Len=44"
"250","12.758097","192.168.100.1","192.168.100.102","TCP","534","8888  >  65382 [PSH, ACK] Seq=10086 Ack=283 Win=14600 Len=480"
"251","12.797341","fe80::69a5:ccfc:54ae:f895","ff02::1:3","LLMNR","94","Standard query 0xa82a AAAA NAS-JG-Schreib"
"252","12.797341","fe80::69a5:ccfc:54ae:f895","ff02::1:3","LLMNR","94","Standard query 0x6621 A NAS-JG-Schreib"
"253","12.797435","192.168.100.102","224.0.0.252","LLMNR","74","Standard query 0x6621 A NAS-JG-Schreib"
"254","12.797798","192.168.100.102","224.0.0.252","LLMNR","74","Standard query 0xa82a AAAA NAS-JG-Schreib"
"255","12.798119","192.168.100.102","224.0.0.251","MDNS","80","Standard query 0x0000 A NAS-JG-Schreib.local, ""QM"" question"
"256","12.799796","fe80::69a5:ccfc:54ae:f895","ff02::fb","MDNS","100","Standard query 0x0000 A NAS-JG-Schreib.local, ""QM"" question"
"257","12.800927","192.168.100.102","224.0.0.251","MDNS","80","Standard query 0x0000 AAAA NAS-JG-Schreib.local, ""QU"" question"
"258","12.802500","fe80::69a5:ccfc:54ae:f895","ff02::fb","MDNS","100","Standard query 0x0000 AAAA NAS-JG-Schreib.local, ""QU"" question"
"259","12.812142","192.168.100.102","192.168.100.1","TCP","54","65382  >  8888 [ACK] Seq=283 Ack=10566 Win=64256 Len=0"
"260","12.813376","192.168.100.102","224.0.0.251","MDNS","80","Standard query 0x0000 A NAS-JG-Schreib.local, ""QM"" question"
"261","12.814854","192.168.100.1","192.168.100.102","TCP","174","8888  >  65382 [PSH, ACK] Seq=10566 Ack=283 Win=14600 Len=120"
"262","12.815153","192.168.100.102","224.0.0.251","MDNS","80","Standard query 0x0000 A NAS-JG-Schreib.local, ""QM"" question"
"263","12.816873","192.168.100.102","224.0.0.251","MDNS","80","Standard query 0x0000 AAAA NAS-JG-Schreib.local, ""QU"" question"
"264","12.818306","fe80::69a5:ccfc:54ae:f895","ff02::fb","MDNS","100","Standard query 0x0000 AAAA NAS-JG-Schreib.local, ""QU"" question"
"265","12.819035","fe80::69a5:ccfc:54ae:f895","ff02::fb","MDNS","100","Standard query 0x0000 A NAS-JG-Schreib.local, ""QM"" question"
"266","12.819816","fe80::69a5:ccfc:54ae:f895","ff02::fb","MDNS","100","Standard query 0x0000 A NAS-JG-Schreib.local, ""QM"" question"
"267","12.820887","192.168.100.102","224.0.0.251","MDNS","80","Standard query 0x0000 AAAA NAS-JG-Schreib.local, ""QU"" question"
"268","12.822127","fe80::69a5:ccfc:54ae:f895","ff02::fb","MDNS","100","Standard query 0x0000 AAAA NAS-JG-Schreib.local, ""QU"" question"
"269","12.859449","192.168.100.102","192.168.100.1","TCP","54","65382  >  8888 [ACK] Seq=283 Ack=10686 Win=64256 Len=0"
"270","12.862290","192.168.100.1","192.168.100.102","TCP","174","8888  >  65382 [PSH, ACK] Seq=10686 Ack=283 Win=14600 Len=120"
"271","12.905373","192.168.100.102","192.168.100.1","TCP","54","65382  >  8888 [ACK] Seq=283 Ack=10806 Win=64000 Len=0"
"272","12.908396","192.168.100.1","192.168.100.102","TCP","134","8888  >  65382 [PSH, ACK] Seq=10806 Ack=283 Win=14600 Len=80"
"273","12.951859","192.168.100.102","192.168.100.1","TCP","54","65382  >  8888 [ACK] Seq=283 Ack=10886 Win=64000 Len=0"
"274","12.954898","192.168.100.1","192.168.100.102","TCP","134","8888  >  65382 [PSH, ACK] Seq=10886 Ack=283 Win=14600 Len=80"
"275","12.998148","192.168.100.102","192.168.100.1","TCP","54","65382  >  8888 [ACK] Seq=283 Ack=10966 Win=64000 Len=0"
"276","13.000972","192.168.100.1","192.168.100.102","TCP","134","8888  >  65382 [PSH, ACK] Seq=10966 Ack=283 Win=14600 Len=80"
"277","13.044203","192.168.100.102","192.168.100.1","TCP","54","65382  >  8888 [ACK] Seq=283 Ack=11046 Win=65280 Len=0"
"278","13.047129","192.168.100.1","192.168.100.102","TCP","174","8888  >  65382 [PSH, ACK] Seq=11046 Ack=283 Win=14600 Len=120"
"279","13.091500","192.168.100.102","192.168.100.1","TCP","54","65382  >  8888 [ACK] Seq=283 Ack=11166 Win=65280 Len=0"
"280","13.094628","192.168.100.1","192.168.100.102","TCP","134","8888  >  65382 [PSH, ACK] Seq=11166 Ack=283 Win=14600 Len=80"
"281","13.126213","192.168.100.102","192.168.100.1","UDP","51","54930  >  8085 Len=9"
"282","13.138020","192.168.100.102","192.168.100.1","TCP","54","65382  >  8888 [ACK] Seq=283 Ack=11246 Win=65280 Len=0"
"283","13.138743","192.168.100.102","192.168.100.255","NBNS","92","Name query NB NAS-JG-SCHREIB<20>"
"284","13.141239","192.168.100.1","192.168.100.102","TCP","238","8888  >  65382 [PSH, ACK] Seq=11246 Ack=283 Win=14600 Len=184"
"285","13.184922","192.168.100.102","192.168.100.1","TCP","54","65382  >  8888 [ACK] Seq=283 Ack=11430 Win=65024 Len=0"
"286","13.187840","192.168.100.1","192.168.100.102","TCP","280","8888  >  65382 [PSH, ACK] Seq=11430 Ack=283 Win=14600 Len=226"
"287","13.231986","192.168.100.102","192.168.100.1","TCP","54","65382  >  8888 [ACK] Seq=283 Ack=11656 Win=64768 Len=0"
"288","13.235120","192.168.100.1","192.168.100.102","TCP","134","8888  >  65382 [PSH, ACK] Seq=11656 Ack=283 Win=14600 Len=80"
"289","13.278335","192.168.100.102","192.168.100.1","TCP","54","65382  >  8888 [ACK] Seq=283 Ack=11736 Win=64768 Len=0"
"290","13.281227","192.168.100.1","192.168.100.102","TCP","134","8888  >  65382 [PSH, ACK] Seq=11736 Ack=283 Win=14600 Len=80"
"291","13.326030","192.168.100.102","192.168.100.1","TCP","54","65382  >  8888 [ACK] Seq=283 Ack=11816 Win=64512 Len=0"
"292","13.328735","192.168.100.1","192.168.100.102","TCP","174","8888  >  65382 [PSH, ACK] Seq=11816 Ack=283 Win=14600 Len=120"
"293","13.372698","192.168.100.102","192.168.100.1","TCP","54","65382  >  8888 [ACK] Seq=283 Ack=11936 Win=64512 Len=0"
"294","13.376052","192.168.100.1","192.168.100.102","TCP","134","8888  >  65382 [PSH, ACK] Seq=11936 Ack=283 Win=14600 Len=80"
"295","13.420114","192.168.100.102","192.168.100.1","TCP","54","65382  >  8888 [ACK] Seq=283 Ack=12016 Win=64512 Len=0"
"296","13.428706","192.168.100.1","192.168.100.102","TCP","174","8888  >  65382 [PSH, ACK] Seq=12016 Ack=283 Win=14600 Len=120"
"297","13.452768","192.168.100.102","192.168.100.1","UDP","61","54930  >  8085 Len=19"
"298","13.474599","192.168.100.102","192.168.100.1","TCP","82","65382  >  8888 [PSH, ACK] Seq=283 Ack=12136 Win=64256 Len=28"
"299","13.477606","192.168.100.1","192.168.100.102","TCP","134","8888  >  65382 [PSH, ACK] Seq=12136 Ack=311 Win=14600 Len=80"
"300","13.503041","192.168.100.102","192.168.100.1","UDP","61","54930  >  8085 Len=19"
"301","13.530674","192.168.100.102","192.168.100.1","TCP","54","65382  >  8888 [ACK] Seq=311 Ack=12216 Win=64256 Len=0"
"302","13.533656","192.168.100.1","192.168.100.102","TCP","174","8888  >  65382 [PSH, ACK] Seq=12216 Ack=311 Win=14600 Len=120"
"303","13.553379","192.168.100.102","192.168.100.1","UDP","61","54930  >  8085 Len=19"
"304","13.577075","192.168.100.102","192.168.100.1","TCP","54","65382  >  8888 [ACK] Seq=311 Ack=12336 Win=64000 Len=0"
"305","13.579825","192.168.100.1","192.168.100.102","TCP","134","8888  >  65382 [PSH, ACK] Seq=12336 Ack=311 Win=14600 Len=80"
"306","13.604199","192.168.100.102","192.168.100.1","UDP","61","54930  >  8085 Len=19"
"307","13.624525","192.168.100.102","192.168.100.1","TCP","54","65382  >  8888 [ACK] Seq=311 Ack=12416 Win=64000 Len=0"
"308","13.632434","192.168.100.1","192.168.100.102","TCP","174","8888  >  65382 [PSH, ACK] Seq=12416 Ack=311 Win=14600 Len=120"
"309","13.654503","192.168.100.102","192.168.100.1","UDP","61","54930  >  8085 Len=19"
"310","13.688068","192.168.100.102","192.168.100.1","TCP","54","65382  >  8888 [ACK] Seq=311 Ack=12536 Win=65280 Len=0"
"311","13.694308","192.168.100.1","192.168.100.102","TCP","174","8888  >  65382 [PSH, ACK] Seq=12536 Ack=311 Win=14600 Len=120"
"312","13.705173","192.168.100.102","192.168.100.1","UDP","61","54930  >  8085 Len=19"
"313","13.735162","192.168.100.102","192.168.100.1","TCP","54","65382  >  8888 [ACK] Seq=311 Ack=12656 Win=65280 Len=0"
"314","13.755473","192.168.100.102","192.168.100.1","UDP","61","54930  >  8085 Len=19"
"315","13.805788","192.168.100.102","192.168.100.1","UDP","61","54930  >  8085 Len=19"
"316","13.856083","192.168.100.102","192.168.100.1","UDP","61","54930  >  8085 Len=19"
"317","13.856467","192.168.100.1","192.168.100.102","ICMP","98","Echo (ping) request  id=0xc724, seq=0/0, ttl=64 (reply in 318)"
"318","13.856763","192.168.100.102","192.168.100.1","ICMP","98","Echo (ping) reply    id=0xc724, seq=0/0, ttl=128 (request in 317)"
"319","13.891887","192.168.100.102","192.168.100.255","NBNS","92","Name query NB NAS-JG-SCHREIB<20>"
"320","13.906617","192.168.100.102","192.168.100.1","UDP","61","54930  >  8085 Len=19"
"321","13.914438","192.168.100.1","192.168.100.255","UDP","86","46573  >  8668 Len=44"
"322","13.948356","192.168.100.1","192.168.100.102","TCP","534","8888  >  65382 [PSH, ACK] Seq=12656 Ack=311 Win=14600 Len=480"
"323","13.956912","192.168.100.102","192.168.100.1","UDP","61","54930  >  8085 Len=19"
"324","13.995881","192.168.100.1","192.168.100.102","UDP","79","57128  >  10920 Len=37"
"325","13.997488","192.168.100.1","192.168.100.102","UDP","58","57128  >  10920 Len=16"
"326","13.997488","192.168.100.1","192.168.100.102","UDP","1476","57128  >  10920 Len=1434"
"327","13.998773","192.168.100.102","192.168.100.1","TCP","54","65382  >  8888 [ACK] Seq=311 Ack=13136 Win=64768 Len=0"
"328","13.999080","192.168.100.1","192.168.100.102","UDP","1476","57128  >  10920 Len=1434"
