No.     Time           Source                Destination           Protocol Length Info
      1 0.000000       192.168.100.1         192.168.100.255       UDP      86     54582 → 8668 Len=44

Frame 1: 86 bytes on wire (688 bits), 86 bytes captured (688 bits) on interface \Device\NPF_{762A3821-E4C2-4F33-9E66-D46B35E7C715}, id 0
    Section number: 1
    Interface id: 0 (\Device\NPF_{762A3821-E4C2-4F33-9E66-D46B35E7C715})
        Interface name: \Device\NPF_{762A3821-E4C2-4F33-9E66-D46B35E7C715}
        Interface description: WLAN 2
    Encapsulation type: Ethernet (1)
    Arrival Time: Aug  1, 2025 19:26:08.597280000 Malay Peninsula Standard Time
    UTC Arrival Time: Aug  1, 2025 11:26:08.597280000 UTC
    Epoch Arrival Time: 1754047568.597280000
    [Time shift for this packet: 0.000000000 seconds]
    [Time delta from previous captured frame: 0.000000000 seconds]
    [Time delta from previous displayed frame: 0.000000000 seconds]
    [Time since reference or first frame: 0.000000000 seconds]
    Frame Number: 1
    Frame Length: 86 bytes (688 bits)
    Capture Length: 86 bytes (688 bits)
    [Frame is marked: False]
    [Frame is ignored: False]
    [Protocols in frame: eth:ethertype:ip:udp:data]
    [Coloring Rule Name: UDP]
    [Coloring Rule String: udp]
Ethernet II, Src: 9a:03:cf:50:1f:ac (9a:03:cf:50:1f:ac), Dst: Broadcast (ff:ff:ff:ff:ff:ff)
    Destination: Broadcast (ff:ff:ff:ff:ff:ff)
        .... ..1. .... .... .... .... = LG bit: Locally administered address (this is NOT the factory default)
        .... ...1 .... .... .... .... = IG bit: Group address (multicast/broadcast)
    Source: 9a:03:cf:50:1f:ac (9a:03:cf:50:1f:ac)
        .... ..1. .... .... .... .... = LG bit: Locally administered address (this is NOT the factory default)
        .... ...0 .... .... .... .... = IG bit: Individual address (unicast)
    Type: IPv4 (0x0800)
    [Stream index: 0]
Internet Protocol Version 4, Src: 192.168.100.1, Dst: 192.168.100.255
    0100 .... = Version: 4
    .... 0101 = Header Length: 20 bytes (5)
    Differentiated Services Field: 0x00 (DSCP: CS0, ECN: Not-ECT)
        0000 00.. = Differentiated Services Codepoint: Default (0)
        .... ..00 = Explicit Congestion Notification: Not ECN-Capable Transport (0)
    Total Length: 72
    Identification: 0x5415 (21525)
    010. .... = Flags: 0x2, Don't fragment
        0... .... = Reserved bit: Not set
        .1.. .... = Don't fragment: Set
        ..0. .... = More fragments: Not set
    ...0 0000 0000 0000 = Fragment Offset: 0
    Time to Live: 64
    Protocol: UDP (17)
    Header Checksum: 0x9c3e [validation disabled]
    [Header checksum status: Unverified]
    Source Address: 192.168.100.1
    Destination Address: 192.168.100.255
    [Stream index: 0]
User Datagram Protocol, Src Port: 54582, Dst Port: 8668
    Source Port: 54582
    Destination Port: 8668
    Length: 52
    Checksum: 0x6d8d [unverified]
    [Checksum Status: Unverified]
    [Stream index: 0]
    [Stream Packet Number: 1]
    [Timestamps]
        [Time since first frame: 0.000000000 seconds]
        [Time since previous frame: 0.000000000 seconds]
    UDP payload (44 bytes)
Data (44 bytes)

0000  fe 24 9b 00 00 e8 43 4e 32 34 30 32 30 31 30 39   .$....CN24020109
0010  36 30 00 00 00 00 31 39 32 2e 31 36 38 2e 31 30   60....192.168.10
0020  30 2e 31 00 00 00 c0 00 ff 00 5c 0b               0.1.......\.
    Data: fe249b0000e8434e32343032303130393630000000003139322e3136382e3130302e31000000c000ff005c0b
    [Length: 44]

No.     Time           Source                Destination           Protocol Length Info
      2 1.000581       192.168.100.1         192.168.100.255       UDP      86     54582 → 8668 Len=44

Frame 2: 86 bytes on wire (688 bits), 86 bytes captured (688 bits) on interface \Device\NPF_{762A3821-E4C2-4F33-9E66-D46B35E7C715}, id 0
    Section number: 1
    Interface id: 0 (\Device\NPF_{762A3821-E4C2-4F33-9E66-D46B35E7C715})
        Interface name: \Device\NPF_{762A3821-E4C2-4F33-9E66-D46B35E7C715}
        Interface description: WLAN 2
    Encapsulation type: Ethernet (1)
    Arrival Time: Aug  1, 2025 19:26:09.597861000 Malay Peninsula Standard Time
    UTC Arrival Time: Aug  1, 2025 11:26:09.597861000 UTC
    Epoch Arrival Time: 1754047569.597861000
    [Time shift for this packet: 0.000000000 seconds]
    [Time delta from previous captured frame: 1.000581000 seconds]
    [Time delta from previous displayed frame: 1.000581000 seconds]
    [Time since reference or first frame: 1.000581000 seconds]
    Frame Number: 2
    Frame Length: 86 bytes (688 bits)
    Capture Length: 86 bytes (688 bits)
    [Frame is marked: False]
    [Frame is ignored: False]
    [Protocols in frame: eth:ethertype:ip:udp:data]
    [Coloring Rule Name: UDP]
    [Coloring Rule String: udp]
Ethernet II, Src: 9a:03:cf:50:1f:ac (9a:03:cf:50:1f:ac), Dst: Broadcast (ff:ff:ff:ff:ff:ff)
    Destination: Broadcast (ff:ff:ff:ff:ff:ff)
        .... ..1. .... .... .... .... = LG bit: Locally administered address (this is NOT the factory default)
        .... ...1 .... .... .... .... = IG bit: Group address (multicast/broadcast)
    Source: 9a:03:cf:50:1f:ac (9a:03:cf:50:1f:ac)
        .... ..1. .... .... .... .... = LG bit: Locally administered address (this is NOT the factory default)
        .... ...0 .... .... .... .... = IG bit: Individual address (unicast)
    Type: IPv4 (0x0800)
    [Stream index: 0]
Internet Protocol Version 4, Src: 192.168.100.1, Dst: 192.168.100.255
    0100 .... = Version: 4
    .... 0101 = Header Length: 20 bytes (5)
    Differentiated Services Field: 0x00 (DSCP: CS0, ECN: Not-ECT)
        0000 00.. = Differentiated Services Codepoint: Default (0)
        .... ..00 = Explicit Congestion Notification: Not ECN-Capable Transport (0)
    Total Length: 72
    Identification: 0x56cb (22219)
    010. .... = Flags: 0x2, Don't fragment
        0... .... = Reserved bit: Not set
        .1.. .... = Don't fragment: Set
        ..0. .... = More fragments: Not set
    ...0 0000 0000 0000 = Fragment Offset: 0
    Time to Live: 64
    Protocol: UDP (17)
    Header Checksum: 0x9988 [validation disabled]
    [Header checksum status: Unverified]
    Source Address: 192.168.100.1
    Destination Address: 192.168.100.255
    [Stream index: 0]
User Datagram Protocol, Src Port: 54582, Dst Port: 8668
    Source Port: 54582
    Destination Port: 8668
    Length: 52
    Checksum: 0x2a43 [unverified]
    [Checksum Status: Unverified]
    [Stream index: 0]
    [Stream Packet Number: 2]
    [Timestamps]
        [Time since first frame: 1.000581000 seconds]
        [Time since previous frame: 1.000581000 seconds]
    UDP payload (44 bytes)
Data (44 bytes)

0000  fe 24 9d 00 00 e8 43 4e 32 34 30 32 30 31 30 39   .$....CN24020109
0010  36 30 00 00 00 00 31 39 32 2e 31 36 38 2e 31 30   60....192.168.10
0020  30 2e 31 00 00 00 c0 00 ff 00 9d 55               0.1........U
    Data: fe249d0000e8434e32343032303130393630000000003139322e3136382e3130302e31000000c000ff009d55
    [Length: 44]

No.     Time           Source                Destination           Protocol Length Info
      3 2.000208       192.168.100.1         192.168.100.255       UDP      86     54582 → 8668 Len=44

Frame 3: 86 bytes on wire (688 bits), 86 bytes captured (688 bits) on interface \Device\NPF_{762A3821-E4C2-4F33-9E66-D46B35E7C715}, id 0
    Section number: 1
    Interface id: 0 (\Device\NPF_{762A3821-E4C2-4F33-9E66-D46B35E7C715})
        Interface name: \Device\NPF_{762A3821-E4C2-4F33-9E66-D46B35E7C715}
        Interface description: WLAN 2
    Encapsulation type: Ethernet (1)
    Arrival Time: Aug  1, 2025 19:26:10.597488000 Malay Peninsula Standard Time
    UTC Arrival Time: Aug  1, 2025 11:26:10.597488000 UTC
    Epoch Arrival Time: 1754047570.597488000
    [Time shift for this packet: 0.000000000 seconds]
    [Time delta from previous captured frame: 0.999627000 seconds]
    [Time delta from previous displayed frame: 0.999627000 seconds]
    [Time since reference or first frame: 2.000208000 seconds]
    Frame Number: 3
    Frame Length: 86 bytes (688 bits)
    Capture Length: 86 bytes (688 bits)
    [Frame is marked: False]
    [Frame is ignored: False]
    [Protocols in frame: eth:ethertype:ip:udp:data]
    [Coloring Rule Name: UDP]
    [Coloring Rule String: udp]
Ethernet II, Src: 9a:03:cf:50:1f:ac (9a:03:cf:50:1f:ac), Dst: Broadcast (ff:ff:ff:ff:ff:ff)
    Destination: Broadcast (ff:ff:ff:ff:ff:ff)
        .... ..1. .... .... .... .... = LG bit: Locally administered address (this is NOT the factory default)
        .... ...1 .... .... .... .... = IG bit: Group address (multicast/broadcast)
    Source: 9a:03:cf:50:1f:ac (9a:03:cf:50:1f:ac)
        .... ..1. .... .... .... .... = LG bit: Locally administered address (this is NOT the factory default)
        .... ...0 .... .... .... .... = IG bit: Individual address (unicast)
    Type: IPv4 (0x0800)
    [Stream index: 0]
Internet Protocol Version 4, Src: 192.168.100.1, Dst: 192.168.100.255
    0100 .... = Version: 4
    .... 0101 = Header Length: 20 bytes (5)
    Differentiated Services Field: 0x00 (DSCP: CS0, ECN: Not-ECT)
        0000 00.. = Differentiated Services Codepoint: Default (0)
        .... ..00 = Explicit Congestion Notification: Not ECN-Capable Transport (0)
    Total Length: 72
    Identification: 0x5714 (22292)
    010. .... = Flags: 0x2, Don't fragment
        0... .... = Reserved bit: Not set
        .1.. .... = Don't fragment: Set
        ..0. .... = More fragments: Not set
    ...0 0000 0000 0000 = Fragment Offset: 0
    Time to Live: 64
    Protocol: UDP (17)
    Header Checksum: 0x993f [validation disabled]
    [Header checksum status: Unverified]
    Source Address: 192.168.100.1
    Destination Address: 192.168.100.255
    [Stream index: 0]
User Datagram Protocol, Src Port: 54582, Dst Port: 8668
    Source Port: 54582
    Destination Port: 8668
    Length: 52
    Checksum: 0xa338 [unverified]
    [Checksum Status: Unverified]
    [Stream index: 0]
    [Stream Packet Number: 3]
    [Timestamps]
        [Time since first frame: 2.000208000 seconds]
        [Time since previous frame: 0.999627000 seconds]
    UDP payload (44 bytes)
Data (44 bytes)

0000  fe 24 9f 00 00 e8 43 4e 32 34 30 32 30 31 30 39   .$....CN24020109
0010  36 30 00 00 00 00 31 39 32 2e 31 36 38 2e 31 30   60....192.168.10
0020  30 2e 31 00 00 00 c0 00 ff 00 22 60               0.1......."`
    Data: fe249f0000e8434e32343032303130393630000000003139322e3136382e3130302e31000000c000ff002260
    [Length: 44]

No.     Time           Source                Destination           Protocol Length Info
      4 3.000441       192.168.100.1         192.168.100.255       UDP      86     54582 → 8668 Len=44

Frame 4: 86 bytes on wire (688 bits), 86 bytes captured (688 bits) on interface \Device\NPF_{762A3821-E4C2-4F33-9E66-D46B35E7C715}, id 0
    Section number: 1
    Interface id: 0 (\Device\NPF_{762A3821-E4C2-4F33-9E66-D46B35E7C715})
        Interface name: \Device\NPF_{762A3821-E4C2-4F33-9E66-D46B35E7C715}
        Interface description: WLAN 2
    Encapsulation type: Ethernet (1)
    Arrival Time: Aug  1, 2025 19:26:11.597721000 Malay Peninsula Standard Time
    UTC Arrival Time: Aug  1, 2025 11:26:11.597721000 UTC
    Epoch Arrival Time: 1754047571.597721000
    [Time shift for this packet: 0.000000000 seconds]
    [Time delta from previous captured frame: 1.000233000 seconds]
    [Time delta from previous displayed frame: 1.000233000 seconds]
    [Time since reference or first frame: 3.000441000 seconds]
    Frame Number: 4
    Frame Length: 86 bytes (688 bits)
    Capture Length: 86 bytes (688 bits)
    [Frame is marked: False]
    [Frame is ignored: False]
    [Protocols in frame: eth:ethertype:ip:udp:data]
    [Coloring Rule Name: UDP]
    [Coloring Rule String: udp]
Ethernet II, Src: 9a:03:cf:50:1f:ac (9a:03:cf:50:1f:ac), Dst: Broadcast (ff:ff:ff:ff:ff:ff)
    Destination: Broadcast (ff:ff:ff:ff:ff:ff)
        .... ..1. .... .... .... .... = LG bit: Locally administered address (this is NOT the factory default)
        .... ...1 .... .... .... .... = IG bit: Group address (multicast/broadcast)
    Source: 9a:03:cf:50:1f:ac (9a:03:cf:50:1f:ac)
        .... ..1. .... .... .... .... = LG bit: Locally administered address (this is NOT the factory default)
        .... ...0 .... .... .... .... = IG bit: Individual address (unicast)
    Type: IPv4 (0x0800)
    [Stream index: 0]
Internet Protocol Version 4, Src: 192.168.100.1, Dst: 192.168.100.255
    0100 .... = Version: 4
    .... 0101 = Header Length: 20 bytes (5)
    Differentiated Services Field: 0x00 (DSCP: CS0, ECN: Not-ECT)
        0000 00.. = Differentiated Services Codepoint: Default (0)
        .... ..00 = Explicit Congestion Notification: Not ECN-Capable Transport (0)
    Total Length: 72
    Identification: 0x58e3 (22755)
    010. .... = Flags: 0x2, Don't fragment
        0... .... = Reserved bit: Not set
        .1.. .... = Don't fragment: Set
        ..0. .... = More fragments: Not set
    ...0 0000 0000 0000 = Fragment Offset: 0
    Time to Live: 64
    Protocol: UDP (17)
    Header Checksum: 0x9770 [validation disabled]
    [Header checksum status: Unverified]
    Source Address: 192.168.100.1
    Destination Address: 192.168.100.255
    [Stream index: 0]
User Datagram Protocol, Src Port: 54582, Dst Port: 8668
    Source Port: 54582
    Destination Port: 8668
    Length: 52
    Checksum: 0x8e8a [unverified]
    [Checksum Status: Unverified]
    [Stream index: 0]
    [Stream Packet Number: 4]
    [Timestamps]
        [Time since first frame: 3.000441000 seconds]
        [Time since previous frame: 1.000233000 seconds]
    UDP payload (44 bytes)
Data (44 bytes)

0000  fe 24 a1 00 00 e8 43 4e 32 34 30 32 30 31 30 39   .$....CN24020109
0010  36 30 00 00 00 00 31 39 32 2e 31 36 38 2e 31 30   60....192.168.10
0020  30 2e 31 00 00 00 c0 00 ff 00 35 0e               0.1.......5.
    Data: fe24a10000e8434e32343032303130393630000000003139322e3136382e3130302e31000000c000ff00350e
    [Length: 44]

No.     Time           Source                Destination           Protocol Length Info
      5 4.001489       192.168.100.1         192.168.100.255       UDP      86     54582 → 8668 Len=44

Frame 5: 86 bytes on wire (688 bits), 86 bytes captured (688 bits) on interface \Device\NPF_{762A3821-E4C2-4F33-9E66-D46B35E7C715}, id 0
    Section number: 1
    Interface id: 0 (\Device\NPF_{762A3821-E4C2-4F33-9E66-D46B35E7C715})
        Interface name: \Device\NPF_{762A3821-E4C2-4F33-9E66-D46B35E7C715}
        Interface description: WLAN 2
    Encapsulation type: Ethernet (1)
    Arrival Time: Aug  1, 2025 19:26:12.598769000 Malay Peninsula Standard Time
    UTC Arrival Time: Aug  1, 2025 11:26:12.598769000 UTC
    Epoch Arrival Time: 1754047572.598769000
    [Time shift for this packet: 0.000000000 seconds]
    [Time delta from previous captured frame: 1.001048000 seconds]
    [Time delta from previous displayed frame: 1.001048000 seconds]
    [Time since reference or first frame: 4.001489000 seconds]
    Frame Number: 5
    Frame Length: 86 bytes (688 bits)
    Capture Length: 86 bytes (688 bits)
    [Frame is marked: False]
    [Frame is ignored: False]
    [Protocols in frame: eth:ethertype:ip:udp:data]
    [Coloring Rule Name: UDP]
    [Coloring Rule String: udp]
Ethernet II, Src: 9a:03:cf:50:1f:ac (9a:03:cf:50:1f:ac), Dst: Broadcast (ff:ff:ff:ff:ff:ff)
    Destination: Broadcast (ff:ff:ff:ff:ff:ff)
        .... ..1. .... .... .... .... = LG bit: Locally administered address (this is NOT the factory default)
        .... ...1 .... .... .... .... = IG bit: Group address (multicast/broadcast)
    Source: 9a:03:cf:50:1f:ac (9a:03:cf:50:1f:ac)
        .... ..1. .... .... .... .... = LG bit: Locally administered address (this is NOT the factory default)
        .... ...0 .... .... .... .... = IG bit: Individual address (unicast)
    Type: IPv4 (0x0800)
    [Stream index: 0]
Internet Protocol Version 4, Src: 192.168.100.1, Dst: 192.168.100.255
    0100 .... = Version: 4
    .... 0101 = Header Length: 20 bytes (5)
    Differentiated Services Field: 0x00 (DSCP: CS0, ECN: Not-ECT)
        0000 00.. = Differentiated Services Codepoint: Default (0)
        .... ..00 = Explicit Congestion Notification: Not ECN-Capable Transport (0)
    Total Length: 72
    Identification: 0x59c1 (22977)
    010. .... = Flags: 0x2, Don't fragment
        0... .... = Reserved bit: Not set
        .1.. .... = Don't fragment: Set
        ..0. .... = More fragments: Not set
    ...0 0000 0000 0000 = Fragment Offset: 0
    Time to Live: 64
    Protocol: UDP (17)
    Header Checksum: 0x9692 [validation disabled]
    [Header checksum status: Unverified]
    Source Address: 192.168.100.1
    Destination Address: 192.168.100.255
    [Stream index: 0]
User Datagram Protocol, Src Port: 54582, Dst Port: 8668
    Source Port: 54582
    Destination Port: 8668
    Length: 52
    Checksum: 0x375d [unverified]
    [Checksum Status: Unverified]
    [Stream index: 0]
    [Stream Packet Number: 5]
    [Timestamps]
        [Time since first frame: 4.001489000 seconds]
        [Time since previous frame: 1.001048000 seconds]
    UDP payload (44 bytes)
Data (44 bytes)

0000  fe 24 a3 00 00 e8 43 4e 32 34 30 32 30 31 30 39   .$....CN24020109
0010  36 30 00 00 00 00 31 39 32 2e 31 36 38 2e 31 30   60....192.168.10
0020  30 2e 31 00 00 00 c0 00 ff 00 8a 3b               0.1........;
    Data: fe24a30000e8434e32343032303130393630000000003139322e3136382e3130302e31000000c000ff008a3b
    [Length: 44]

No.     Time           Source                Destination           Protocol Length Info
      6 4.813661       192.168.100.102       192.168.100.1         DNS      94     Standard query 0xbc7b A p2p-hkg1.discovery.steamserver.net

Frame 6: 94 bytes on wire (752 bits), 94 bytes captured (752 bits) on interface \Device\NPF_{762A3821-E4C2-4F33-9E66-D46B35E7C715}, id 0
    Section number: 1
    Interface id: 0 (\Device\NPF_{762A3821-E4C2-4F33-9E66-D46B35E7C715})
        Interface name: \Device\NPF_{762A3821-E4C2-4F33-9E66-D46B35E7C715}
        Interface description: WLAN 2
    Encapsulation type: Ethernet (1)
    Arrival Time: Aug  1, 2025 19:26:13.410941000 Malay Peninsula Standard Time
    UTC Arrival Time: Aug  1, 2025 11:26:13.410941000 UTC
    Epoch Arrival Time: 1754047573.410941000
    [Time shift for this packet: 0.000000000 seconds]
    [Time delta from previous captured frame: 0.812172000 seconds]
    [Time delta from previous displayed frame: 0.812172000 seconds]
    [Time since reference or first frame: 4.813661000 seconds]
    Frame Number: 6
    Frame Length: 94 bytes (752 bits)
    Capture Length: 94 bytes (752 bits)
    [Frame is marked: False]
    [Frame is ignored: False]
    [Protocols in frame: eth:ethertype:ip:udp:dns]
    [Coloring Rule Name: UDP]
    [Coloring Rule String: udp]
Ethernet II, Src: DLinkInterna_ca:55:b2 (a0:a3:f0:ca:55:b2), Dst: 9a:03:cf:50:1f:ac (9a:03:cf:50:1f:ac)
    Destination: 9a:03:cf:50:1f:ac (9a:03:cf:50:1f:ac)
        .... ..1. .... .... .... .... = LG bit: Locally administered address (this is NOT the factory default)
        .... ...0 .... .... .... .... = IG bit: Individual address (unicast)
    Source: DLinkInterna_ca:55:b2 (a0:a3:f0:ca:55:b2)
        .... ..0. .... .... .... .... = LG bit: Globally unique address (factory default)
        .... ...0 .... .... .... .... = IG bit: Individual address (unicast)
    Type: IPv4 (0x0800)
    [Stream index: 1]
Internet Protocol Version 4, Src: 192.168.100.102, Dst: 192.168.100.1
    0100 .... = Version: 4
    .... 0101 = Header Length: 20 bytes (5)
    Differentiated Services Field: 0x00 (DSCP: CS0, ECN: Not-ECT)
        0000 00.. = Differentiated Services Codepoint: Default (0)
        .... ..00 = Explicit Congestion Notification: Not ECN-Capable Transport (0)
    Total Length: 80
    Identification: 0x1518 (5400)
    000. .... = Flags: 0x0
        0... .... = Reserved bit: Not set
        .0.. .... = Don't fragment: Not set
        ..0. .... = More fragments: Not set
    ...0 0000 0000 0000 = Fragment Offset: 0
    Time to Live: 128
    Protocol: UDP (17)
    Header Checksum: 0xdbcc [validation disabled]
    [Header checksum status: Unverified]
    Source Address: 192.168.100.102
    Destination Address: 192.168.100.1
    [Stream index: 1]
User Datagram Protocol, Src Port: 59492, Dst Port: 53
    Source Port: 59492
    Destination Port: 53
    Length: 60
    Checksum: 0x6ea0 [unverified]
    [Checksum Status: Unverified]
    [Stream index: 1]
    [Stream Packet Number: 1]
    [Timestamps]
        [Time since first frame: 0.000000000 seconds]
        [Time since previous frame: 0.000000000 seconds]
    UDP payload (52 bytes)
Domain Name System (query)
    Transaction ID: 0xbc7b
    Flags: 0x0100 Standard query
        0... .... .... .... = Response: Message is a query
        .000 0... .... .... = Opcode: Standard query (0)
        .... ..0. .... .... = Truncated: Message is not truncated
        .... ...1 .... .... = Recursion desired: Do query recursively
        .... .... .0.. .... = Z: reserved (0)
        .... .... ...0 .... = Non-authenticated data: Unacceptable
    Questions: 1
    Answer RRs: 0
    Authority RRs: 0
    Additional RRs: 0
    Queries
        p2p-hkg1.discovery.steamserver.net: type A, class IN
            Name: p2p-hkg1.discovery.steamserver.net
            [Name Length: 34]
            [Label Count: 4]
            Type: A (1) (Host Address)
            Class: IN (0x0001)
    [Response In: 7]

No.     Time           Source                Destination           Protocol Length Info
      7 4.817281       192.168.100.1         192.168.100.102       DNS      94     Standard query response 0xbc7b Refused A p2p-hkg1.discovery.steamserver.net

Frame 7: 94 bytes on wire (752 bits), 94 bytes captured (752 bits) on interface \Device\NPF_{762A3821-E4C2-4F33-9E66-D46B35E7C715}, id 0
    Section number: 1
    Interface id: 0 (\Device\NPF_{762A3821-E4C2-4F33-9E66-D46B35E7C715})
        Interface name: \Device\NPF_{762A3821-E4C2-4F33-9E66-D46B35E7C715}
        Interface description: WLAN 2
    Encapsulation type: Ethernet (1)
    Arrival Time: Aug  1, 2025 19:26:13.414561000 Malay Peninsula Standard Time
    UTC Arrival Time: Aug  1, 2025 11:26:13.414561000 UTC
    Epoch Arrival Time: 1754047573.414561000
    [Time shift for this packet: 0.000000000 seconds]
    [Time delta from previous captured frame: 0.003620000 seconds]
    [Time delta from previous displayed frame: 0.003620000 seconds]
    [Time since reference or first frame: 4.817281000 seconds]
    Frame Number: 7
    Frame Length: 94 bytes (752 bits)
    Capture Length: 94 bytes (752 bits)
    [Frame is marked: False]
    [Frame is ignored: False]
    [Protocols in frame: eth:ethertype:ip:udp:dns]
    [Coloring Rule Name: UDP]
    [Coloring Rule String: udp]
Ethernet II, Src: 9a:03:cf:50:1f:ac (9a:03:cf:50:1f:ac), Dst: DLinkInterna_ca:55:b2 (a0:a3:f0:ca:55:b2)
    Destination: DLinkInterna_ca:55:b2 (a0:a3:f0:ca:55:b2)
        .... ..0. .... .... .... .... = LG bit: Globally unique address (factory default)
        .... ...0 .... .... .... .... = IG bit: Individual address (unicast)
    Source: 9a:03:cf:50:1f:ac (9a:03:cf:50:1f:ac)
        .... ..1. .... .... .... .... = LG bit: Locally administered address (this is NOT the factory default)
        .... ...0 .... .... .... .... = IG bit: Individual address (unicast)
    Type: IPv4 (0x0800)
    [Stream index: 1]
Internet Protocol Version 4, Src: 192.168.100.1, Dst: 192.168.100.102
    0100 .... = Version: 4
    .... 0101 = Header Length: 20 bytes (5)
    Differentiated Services Field: 0x00 (DSCP: CS0, ECN: Not-ECT)
        0000 00.. = Differentiated Services Codepoint: Default (0)
        .... ..00 = Explicit Congestion Notification: Not ECN-Capable Transport (0)
    Total Length: 80
    Identification: 0x01a6 (422)
    010. .... = Flags: 0x2, Don't fragment
        0... .... = Reserved bit: Not set
        .1.. .... = Don't fragment: Set
        ..0. .... = More fragments: Not set
    ...0 0000 0000 0000 = Fragment Offset: 0
    Time to Live: 64
    Protocol: UDP (17)
    Header Checksum: 0xef3e [validation disabled]
    [Header checksum status: Unverified]
    Source Address: 192.168.100.1
    Destination Address: 192.168.100.102
    [Stream index: 1]
User Datagram Protocol, Src Port: 53, Dst Port: 59492
    Source Port: 53
    Destination Port: 59492
    Length: 60
    Checksum: 0xee1a [unverified]
    [Checksum Status: Unverified]
    [Stream index: 1]
    [Stream Packet Number: 2]
    [Timestamps]
        [Time since first frame: 0.003620000 seconds]
        [Time since previous frame: 0.003620000 seconds]
    UDP payload (52 bytes)
Domain Name System (response)
    Transaction ID: 0xbc7b
    Flags: 0x8185 Standard query response, Refused
        1... .... .... .... = Response: Message is a response
        .000 0... .... .... = Opcode: Standard query (0)
        .... .0.. .... .... = Authoritative: Server is not an authority for domain
        .... ..0. .... .... = Truncated: Message is not truncated
        .... ...1 .... .... = Recursion desired: Do query recursively
        .... .... 1... .... = Recursion available: Server can do recursive queries
        .... .... .0.. .... = Z: reserved (0)
        .... .... ..0. .... = Answer authenticated: Answer/authority portion was not authenticated by the server
        .... .... ...0 .... = Non-authenticated data: Unacceptable
        .... .... .... 0101 = Reply code: Refused (5)
    Questions: 1
    Answer RRs: 0
    Authority RRs: 0
    Additional RRs: 0
    Queries
        p2p-hkg1.discovery.steamserver.net: type A, class IN
            Name: p2p-hkg1.discovery.steamserver.net
            [Name Length: 34]
            [Label Count: 4]
            Type: A (1) (Host Address)
            Class: IN (0x0001)
    [Request In: 6]
    [Time: 0.003620000 seconds]

No.     Time           Source                Destination           Protocol Length Info
      8 5.502171       192.168.100.102       192.168.100.1         DNS      92     Standard query 0xa046 A mobile.events.data.microsoft.com

Frame 8: 92 bytes on wire (736 bits), 92 bytes captured (736 bits) on interface \Device\NPF_{762A3821-E4C2-4F33-9E66-D46B35E7C715}, id 0
    Section number: 1
    Interface id: 0 (\Device\NPF_{762A3821-E4C2-4F33-9E66-D46B35E7C715})
        Interface name: \Device\NPF_{762A3821-E4C2-4F33-9E66-D46B35E7C715}
        Interface description: WLAN 2
    Encapsulation type: Ethernet (1)
    Arrival Time: Aug  1, 2025 19:26:14.099451000 Malay Peninsula Standard Time
    UTC Arrival Time: Aug  1, 2025 11:26:14.099451000 UTC
    Epoch Arrival Time: 1754047574.099451000
    [Time shift for this packet: 0.000000000 seconds]
    [Time delta from previous captured frame: 0.684890000 seconds]
    [Time delta from previous displayed frame: 0.684890000 seconds]
    [Time since reference or first frame: 5.502171000 seconds]
    Frame Number: 8
    Frame Length: 92 bytes (736 bits)
    Capture Length: 92 bytes (736 bits)
    [Frame is marked: False]
    [Frame is ignored: False]
    [Protocols in frame: eth:ethertype:ip:udp:dns]
    [Coloring Rule Name: UDP]
    [Coloring Rule String: udp]
Ethernet II, Src: DLinkInterna_ca:55:b2 (a0:a3:f0:ca:55:b2), Dst: 9a:03:cf:50:1f:ac (9a:03:cf:50:1f:ac)
    Destination: 9a:03:cf:50:1f:ac (9a:03:cf:50:1f:ac)
        .... ..1. .... .... .... .... = LG bit: Locally administered address (this is NOT the factory default)
        .... ...0 .... .... .... .... = IG bit: Individual address (unicast)
    Source: DLinkInterna_ca:55:b2 (a0:a3:f0:ca:55:b2)
        .... ..0. .... .... .... .... = LG bit: Globally unique address (factory default)
        .... ...0 .... .... .... .... = IG bit: Individual address (unicast)
    Type: IPv4 (0x0800)
    [Stream index: 1]
Internet Protocol Version 4, Src: 192.168.100.102, Dst: 192.168.100.1
    0100 .... = Version: 4
    .... 0101 = Header Length: 20 bytes (5)
    Differentiated Services Field: 0x00 (DSCP: CS0, ECN: Not-ECT)
        0000 00.. = Differentiated Services Codepoint: Default (0)
        .... ..00 = Explicit Congestion Notification: Not ECN-Capable Transport (0)
    Total Length: 78
    Identification: 0x1519 (5401)
    000. .... = Flags: 0x0
        0... .... = Reserved bit: Not set
        .0.. .... = Don't fragment: Not set
        ..0. .... = More fragments: Not set
    ...0 0000 0000 0000 = Fragment Offset: 0
    Time to Live: 128
    Protocol: UDP (17)
    Header Checksum: 0xdbcd [validation disabled]
    [Header checksum status: Unverified]
    Source Address: 192.168.100.102
    Destination Address: 192.168.100.1
    [Stream index: 1]
User Datagram Protocol, Src Port: 59492, Dst Port: 53
    Source Port: 59492
    Destination Port: 53
    Length: 58
    Checksum: 0xed38 [unverified]
    [Checksum Status: Unverified]
    [Stream index: 1]
    [Stream Packet Number: 3]
    [Timestamps]
        [Time since first frame: 0.688510000 seconds]
        [Time since previous frame: 0.684890000 seconds]
    UDP payload (50 bytes)
Domain Name System (query)
    Transaction ID: 0xa046
    Flags: 0x0100 Standard query
        0... .... .... .... = Response: Message is a query
        .000 0... .... .... = Opcode: Standard query (0)
        .... ..0. .... .... = Truncated: Message is not truncated
        .... ...1 .... .... = Recursion desired: Do query recursively
        .... .... .0.. .... = Z: reserved (0)
        .... .... ...0 .... = Non-authenticated data: Unacceptable
    Questions: 1
    Answer RRs: 0
    Authority RRs: 0
    Additional RRs: 0
    Queries
        mobile.events.data.microsoft.com: type A, class IN
            Name: mobile.events.data.microsoft.com
            [Name Length: 32]
            [Label Count: 5]
            Type: A (1) (Host Address)
            Class: IN (0x0001)
    [Response In: 9]

No.     Time           Source                Destination           Protocol Length Info
      9 5.517060       192.168.100.1         192.168.100.102       DNS      92     Standard query response 0xa046 Refused A mobile.events.data.microsoft.com

Frame 9: 92 bytes on wire (736 bits), 92 bytes captured (736 bits) on interface \Device\NPF_{762A3821-E4C2-4F33-9E66-D46B35E7C715}, id 0
    Section number: 1
    Interface id: 0 (\Device\NPF_{762A3821-E4C2-4F33-9E66-D46B35E7C715})
        Interface name: \Device\NPF_{762A3821-E4C2-4F33-9E66-D46B35E7C715}
        Interface description: WLAN 2
    Encapsulation type: Ethernet (1)
    Arrival Time: Aug  1, 2025 19:26:14.114340000 Malay Peninsula Standard Time
    UTC Arrival Time: Aug  1, 2025 11:26:14.114340000 UTC
    Epoch Arrival Time: 1754047574.114340000
    [Time shift for this packet: 0.000000000 seconds]
    [Time delta from previous captured frame: 0.014889000 seconds]
    [Time delta from previous displayed frame: 0.014889000 seconds]
    [Time since reference or first frame: 5.517060000 seconds]
    Frame Number: 9
    Frame Length: 92 bytes (736 bits)
    Capture Length: 92 bytes (736 bits)
    [Frame is marked: False]
    [Frame is ignored: False]
    [Protocols in frame: eth:ethertype:ip:udp:dns]
    [Coloring Rule Name: UDP]
    [Coloring Rule String: udp]
Ethernet II, Src: 9a:03:cf:50:1f:ac (9a:03:cf:50:1f:ac), Dst: DLinkInterna_ca:55:b2 (a0:a3:f0:ca:55:b2)
    Destination: DLinkInterna_ca:55:b2 (a0:a3:f0:ca:55:b2)
        .... ..0. .... .... .... .... = LG bit: Globally unique address (factory default)
        .... ...0 .... .... .... .... = IG bit: Individual address (unicast)
    Source: 9a:03:cf:50:1f:ac (9a:03:cf:50:1f:ac)
        .... ..1. .... .... .... .... = LG bit: Locally administered address (this is NOT the factory default)
        .... ...0 .... .... .... .... = IG bit: Individual address (unicast)
    Type: IPv4 (0x0800)
    [Stream index: 1]
Internet Protocol Version 4, Src: 192.168.100.1, Dst: 192.168.100.102
    0100 .... = Version: 4
    .... 0101 = Header Length: 20 bytes (5)
    Differentiated Services Field: 0x00 (DSCP: CS0, ECN: Not-ECT)
        0000 00.. = Differentiated Services Codepoint: Default (0)
        .... ..00 = Explicit Congestion Notification: Not ECN-Capable Transport (0)
    Total Length: 78
    Identification: 0x043b (1083)
    010. .... = Flags: 0x2, Don't fragment
        0... .... = Reserved bit: Not set
        .1.. .... = Don't fragment: Set
        ..0. .... = More fragments: Not set
    ...0 0000 0000 0000 = Fragment Offset: 0
    Time to Live: 64
    Protocol: UDP (17)
    Header Checksum: 0xecab [validation disabled]
    [Header checksum status: Unverified]
    Source Address: 192.168.100.1
    Destination Address: 192.168.100.102
    [Stream index: 1]
User Datagram Protocol, Src Port: 53, Dst Port: 59492
    Source Port: 53
    Destination Port: 59492
    Length: 58
    Checksum: 0x6cb3 [unverified]
    [Checksum Status: Unverified]
    [Stream index: 1]
    [Stream Packet Number: 4]
    [Timestamps]
        [Time since first frame: 0.703399000 seconds]
        [Time since previous frame: 0.014889000 seconds]
    UDP payload (50 bytes)
Domain Name System (response)
    Transaction ID: 0xa046
    Flags: 0x8185 Standard query response, Refused
        1... .... .... .... = Response: Message is a response
        .000 0... .... .... = Opcode: Standard query (0)
        .... .0.. .... .... = Authoritative: Server is not an authority for domain
        .... ..0. .... .... = Truncated: Message is not truncated
        .... ...1 .... .... = Recursion desired: Do query recursively
        .... .... 1... .... = Recursion available: Server can do recursive queries
        .... .... .0.. .... = Z: reserved (0)
        .... .... ..0. .... = Answer authenticated: Answer/authority portion was not authenticated by the server
        .... .... ...0 .... = Non-authenticated data: Unacceptable
        .... .... .... 0101 = Reply code: Refused (5)
    Questions: 1
    Answer RRs: 0
    Authority RRs: 0
    Additional RRs: 0
    Queries
        mobile.events.data.microsoft.com: type A, class IN
            Name: mobile.events.data.microsoft.com
            [Name Length: 32]
            [Label Count: 5]
            Type: A (1) (Host Address)
            Class: IN (0x0001)
    [Request In: 8]
    [Time: 0.014889000 seconds]

No.     Time           Source                Destination           Protocol Length Info
     10 5.656227       192.168.100.102       192.168.100.1         TCP      66     64157 → 8888 [SYN] Seq=0 Win=65535 Len=0 MSS=1460 WS=256 SACK_PERM

Frame 10: 66 bytes on wire (528 bits), 66 bytes captured (528 bits) on interface \Device\NPF_{762A3821-E4C2-4F33-9E66-D46B35E7C715}, id 0
    Section number: 1
    Interface id: 0 (\Device\NPF_{762A3821-E4C2-4F33-9E66-D46B35E7C715})
        Interface name: \Device\NPF_{762A3821-E4C2-4F33-9E66-D46B35E7C715}
        Interface description: WLAN 2
    Encapsulation type: Ethernet (1)
    Arrival Time: Aug  1, 2025 19:26:14.253507000 Malay Peninsula Standard Time
    UTC Arrival Time: Aug  1, 2025 11:26:14.253507000 UTC
    Epoch Arrival Time: 1754047574.253507000
    [Time shift for this packet: 0.000000000 seconds]
    [Time delta from previous captured frame: 0.139167000 seconds]
    [Time delta from previous displayed frame: 0.139167000 seconds]
    [Time since reference or first frame: 5.656227000 seconds]
    Frame Number: 10
    Frame Length: 66 bytes (528 bits)
    Capture Length: 66 bytes (528 bits)
    [Frame is marked: False]
    [Frame is ignored: False]
    [Protocols in frame: eth:ethertype:ip:tcp]
    [Coloring Rule Name: TCP SYN/FIN]
    [Coloring Rule String: tcp.flags & 0x02 || tcp.flags.fin == 1]
Ethernet II, Src: DLinkInterna_ca:55:b2 (a0:a3:f0:ca:55:b2), Dst: 9a:03:cf:50:1f:ac (9a:03:cf:50:1f:ac)
    Destination: 9a:03:cf:50:1f:ac (9a:03:cf:50:1f:ac)
        .... ..1. .... .... .... .... = LG bit: Locally administered address (this is NOT the factory default)
        .... ...0 .... .... .... .... = IG bit: Individual address (unicast)
    Source: DLinkInterna_ca:55:b2 (a0:a3:f0:ca:55:b2)
        .... ..0. .... .... .... .... = LG bit: Globally unique address (factory default)
        .... ...0 .... .... .... .... = IG bit: Individual address (unicast)
    Type: IPv4 (0x0800)
    [Stream index: 1]
Internet Protocol Version 4, Src: 192.168.100.102, Dst: 192.168.100.1
    0100 .... = Version: 4
    .... 0101 = Header Length: 20 bytes (5)
    Differentiated Services Field: 0x00 (DSCP: CS0, ECN: Not-ECT)
        0000 00.. = Differentiated Services Codepoint: Default (0)
        .... ..00 = Explicit Congestion Notification: Not ECN-Capable Transport (0)
    Total Length: 52
    Identification: 0x151a (5402)
    010. .... = Flags: 0x2, Don't fragment
        0... .... = Reserved bit: Not set
        .1.. .... = Don't fragment: Set
        ..0. .... = More fragments: Not set
    ...0 0000 0000 0000 = Fragment Offset: 0
    Time to Live: 128
    Protocol: TCP (6)
    Header Checksum: 0x9bf1 [validation disabled]
    [Header checksum status: Unverified]
    Source Address: 192.168.100.102
    Destination Address: 192.168.100.1
    [Stream index: 1]
Transmission Control Protocol, Src Port: 64157, Dst Port: 8888, Seq: 0, Len: 0
    Source Port: 64157
    Destination Port: 8888
    [Stream index: 0]
    [Stream Packet Number: 1]
    [Conversation completeness: Complete, WITH_DATA (47)]
        ..1. .... = RST: Present
        ...0 .... = FIN: Absent
        .... 1... = Data: Present
        .... .1.. = ACK: Present
        .... ..1. = SYN-ACK: Present
        .... ...1 = SYN: Present
        [Completeness Flags: R·DASS]
    [TCP Segment Len: 0]
    Sequence Number: 0    (relative sequence number)
    Sequence Number (raw): 2288022923
    [Next Sequence Number: 1    (relative sequence number)]
    Acknowledgment Number: 0
    Acknowledgment number (raw): 0
    1000 .... = Header Length: 32 bytes (8)
    Flags: 0x002 (SYN)
        000. .... .... = Reserved: Not set
        ...0 .... .... = Accurate ECN: Not set
        .... 0... .... = Congestion Window Reduced: Not set
        .... .0.. .... = ECN-Echo: Not set
        .... ..0. .... = Urgent: Not set
        .... ...0 .... = Acknowledgment: Not set
        .... .... 0... = Push: Not set
        .... .... .0.. = Reset: Not set
        .... .... ..1. = Syn: Set
            [Expert Info (Chat/Sequence): Connection establish request (SYN): server port 8888]
                [Connection establish request (SYN): server port 8888]
                [Severity level: Chat]
                [Group: Sequence]
        .... .... ...0 = Fin: Not set
        [TCP Flags: ··········S·]
    Window: 65535
    [Calculated window size: 65535]
    Checksum: 0x0a16 [unverified]
    [Checksum Status: Unverified]
    Urgent Pointer: 0
    Options: (12 bytes), Maximum segment size, No-Operation (NOP), Window scale, No-Operation (NOP), No-Operation (NOP), SACK permitted
        TCP Option - Maximum segment size: 1460 bytes
            Kind: Maximum Segment Size (2)
            Length: 4
            MSS Value: 1460
        TCP Option - No-Operation (NOP)
            Kind: No-Operation (1)
        TCP Option - Window scale: 8 (multiply by 256)
